,type,title,director,cast,country,release_year,rating,duration,listed_in
46,Movie,Safe House,Daniel Espinosa,"Denzel Washington, Ryan Reynolds, Vera Farmiga, Brendan Gleeson, Sam Shepard, Rubén Blades, Nora Arnezeder, Robert Patrick, Liam Cunningham, Joel Kinnaman","South Africa, United States, Japan",2012,R,115 min,Action & Adventure
48,Movie,Training Day,Antoine Fuqua,"Denzel Washington, Ethan Hawke, Scott Glenn, Tom Berenger, Harris Yulin, Raymond J. Barry, Cliff Curtis, Dr. Dre, Snoop Dogg, Macy Gray, Eva Mendes",United States,2001,R,122 min,"Dramas, Thrillers"
81,Movie,Kate,Cedric Nicolas-Troyan,"Mary Elizabeth Winstead, Jun Kunimura, Woody Harrelson, Tadanobu Asano, Miyavi, Michiel Huisman, Miku Martineau",United States,2021,R,106 min,Action & Adventure
122,Movie,In the Cut,Jane Campion,"Meg Ryan, Mark Ruffalo, Jennifer Jason Leigh, Nick Damici, Sharrieff Pugh, Kevin Bacon, Yaani King Mondschein, Heather Litteer","United Kingdom, Australia, France, United States",2003,R,118 min,Thrillers
131,Movie,Blade Runner: The Final Cut,Ridley Scott,"Harrison Ford, Rutger Hauer, Sean Young, Edward James Olmos, M. Emmet Walsh, Daryl Hannah, William Sanderson, Brion James, Joe Turkel, Joanna Cassidy, James Hong, Morgan Paull",United States,1982,R,117 min,"Action & Adventure, Classic Movies, Cult Movies"
133,Movie,Chappie,Neill Blomkamp,"Sharlto Copley, Hugh Jackman, Sigourney Weaver, Dev Patel, Ninja, Yo-Landi Visser, Jose Pablo Cantillo, Brandon Auret, Johnny Selema, Maurice Carpede","South Africa, United States",2015,R,121 min,"Action & Adventure, Sci-Fi & Fantasy"
135,Movie,Cliffhanger,Renny Harlin,"Sylvester Stallone, John Lithgow, Michael Rooker, Janine Turner, Rex Linn, Caroline Goodall, Leon, Craig Fairbrass, Ralph Waite, Max Perlich, Paul Winfield","United States, Italy, France, Japan",1993,R,113 min,Action & Adventure
136,Movie,Cold Mountain,Anthony Minghella,"Jude Law, Nicole Kidman, Renée Zellweger, Eileen Atkins, Brendan Gleeson, Philip Seymour Hoffman, Natalie Portman, Giovanni Ribisi, Donald Sutherland, Ray Winstone","United States, Italy, Romania, United Kingdom",2003,R,154 min,"Dramas, Romantic Movies"
139,Movie,Do the Right Thing,Spike Lee,"Danny Aiello, Ossie Davis, Ruby Dee, Richard Edson, Giancarlo Esposito, Spike Lee, Bill Nunn, John Turturro, Paul Benjamin, Frankie Faison, Samuel L. Jackson, Rosie Perez, Martin Lawrence, Miguel Sandoval",United States,1989,R,120 min,"Classic Movies, Comedies, Dramas"
141,Movie,Extraction,Steven C. Miller,"Bruce Willis, Kellan Lutz, Gina Carano, D.B. Sweeney, Joshua Mikel, Steve Coulter, Dan Bilzerian, Heather Johansen","United States, United Kingdom, Canada",2015,R,82 min,Action & Adventure
144,Movie,House Party,Reginald Hudlin,"Christopher Reid, Christopher Martin, Robin Harris, Tisha Campbell, A.J. Johnson, Martin Lawrence, Paul Anthony, Bowlegged Lou, B-Fine, Edith Fields, Kelly Jo Minter, Clifton Powell, Verda Bridges",United States,1990,R,104 min,"Comedies, Cult Movies"
145,Movie,House Party 2,"George Jackson, Doug McHenry","Christopher Reid, Christopher Martin, Martin Lawrence, Bowlegged Lou, Paul Anthony, B-Fine, Tisha Campbell, Kamron, Iman, Queen Latifah",United States,1991,R,94 min,"Comedies, Cult Movies, Music & Musicals"
146,Movie,House Party 3,Eric Meza,"Christopher Reid, Christopher Martin, Tisha Campbell, David Edwards, Angela Means, Ketty Lester, Bernie Mac, Michael Colyar, Chris Tucker, Khandi Alexander",United States,1994,R,94 min,"Comedies, Music & Musicals"
149,Movie,I Got the Hook Up,Michael Martin,"Master P, Anthony Johnson, Gretchen Palmer, Frantz Turner, Richard Keats, Joe Estevez, William Knight, Anthony Boswell, Tommy 'Tiny' Lister, Helen Martin, John Witherspoon, Mia X",United States,1998,R,93 min,"Action & Adventure, Comedies"
150,Movie,In Too Deep,Michael Rymer,"Omar Epps, LL Cool J, Nia Long, Stanley Tucci, Pam Grier, Hill Harper, Jake Weber, David Patrick Kelly, Veronica Webb, Ron Canada, Robert LaSardo, Gano Grills, Ivonne Coll, Don Harvey, Mya, Nasir 'Nas' Jones, Jermaine Dupri",United States,1999,R,97 min,Thrillers
163,Movie,My Boss's Daughter,David Zucker,"Ashton Kutcher, Tara Reid, Jeffrey Tambor, Andy Richter, Michael Madsen, Jon Abrahams, David Koechner, Carmen Electra, Kenan Thompson, Terence Stamp, Molly Shannon",United States,2003,R,86 min,"Comedies, Romantic Movies"
166,Movie,Once Upon a Time in America,Sergio Leone,"Robert De Niro, James Woods, Elizabeth McGovern, Treat Williams, Tuesday Weld, Burt Young, Joe Pesci, Danny Aiello, William Forsythe, James Hayden","Italy, United States",1984,R,229 min,"Classic Movies, Dramas"
170,Movie,Rhyme & Reason,Peter Spirer,"Too $hort, B-Real, Kurtis Blow, Da Brat, Grandmaster Caz, Sean ""P. Diddy"" Combs, Chuck D., Desiree Densiti, Dr. Dre, E-40, MC Eiht, Heavy D, Lauryn Hill, Ice-T, Wyclef Jean, Ras Kass, KRS-One, L.V., Mack 10, Craig Mack, Method Man, Keith Murray, Nasir 'Nas' Jones, The Notorious B.I.G., Master P, Q-Tip, Raekwon, Redman, Senen Reyes, Busta Rhymes, RZA, DJ Scratch, Erick Sermon, Tupac Shakur, Adario Strange, Suave",United States,1997,R,89 min,"Documentaries, Music & Musicals"
174,Movie,Tears of the Sun,Antoine Fuqua,"Bruce Willis, Monica Bellucci, Cole Hauser, Eamonn Walker, Johnny Messner, Nick Chinlund, Charles Ingram, Paul Francis, Chad Smith, Tom Skerritt, Malick Bowens, Awaovieyi Agie",United States,2003,R,121 min,"Action & Adventure, Dramas"
175,Movie,The Blue Lagoon,Randal Kleiser,"Brooke Shields, Christopher Atkins, Leo McKern, William Daniels, Elva Josephson, Glenn Kohan, Alan Hopgood, Gus Mercurio",United States,1980,R,105 min,"Dramas, Romantic Movies"
178,Movie,The Interview,"Evan Goldberg, Seth Rogen","James Franco, Seth Rogen, Lizzy Caplan, Randall Park, Diana Bang, Timothy Simons, Reese Alexander, James Yi",United States,2014,R,112 min,"Action & Adventure, Comedies"
183,Movie,In the Line of Fire,Wolfgang Petersen,"Clint Eastwood, John Malkovich, Rene Russo, Dylan McDermott, Gary Cole, Fred Thompson, John Mahoney, Gregory Alan Williams, Jim Curley, Sally Hughes",United States,1993,R,129 min,"Action & Adventure, Classic Movies"
191,Movie,Wind River,Taylor Sheridan,"Jeremy Renner, Elizabeth Olsen, Jon Bernthal, Gil Birmingham, Kelsey Asbille, Tantoo Cardinal, Teo Briones, Matthew Del Negro, Hugh Dillon, Julia Jones, James Jordan, Eric Lange, Martin Sensmeier, Mason Davis, Graham Greene","United Kingdom, Canada, United States",2017,R,107 min,"Dramas, Independent Movies"
228,Movie,The November Man,Roger Donaldson,"Pierce Brosnan, Luke Bracey, Olga Kurylenko, Eliza Taylor, Caterina Scorsone, Bill Smitrovich, Will Patton, Amila Terzimehic, Lazar Ristovski, Mediha Musliovic","United States, United Kingdom",2014,R,108 min,Action & Adventure
247,Movie,Sweet Girl,Brian Andrew Mendoza,"Jason Momoa, Isabela Merced, Manuel Garcia-Rulfo, Amy Brenneman, Adria Arjona, Raza Jaffrey, Justin Bartha, Lex Scott Davis, Michael Raymond-James",United States,2021,R,110 min,"Action & Adventure, Dramas"
264,Movie,Walk of Shame,Steve Brill,"Elizabeth Banks, James Marsden, Gillian Jacobs, Sarah Wright, Ethan Suplee, Bill Burr, Ken Davitian, Lawrence Gilliard Jr., Alphonso Mcauley, Da'Vone McDonald, John Marsden, Willie Garson, Oliver Hudson, P.J. Byrne",United States,2014,R,94 min,"Comedies, Independent Movies"
267,Movie,The Piano,Jane Campion,"Holly Hunter, Harvey Keitel, Sam Neill, Anna Paquin, Kerry Walker, Genevieve Lemon, Tungia Baker, Ian Mune","New Zealand, Australia, France, United States",1993,R,121 min,"Classic Movies, Dramas, Independent Movies"
314,Movie,Heavy,James Mangold,"Pruitt Taylor Vince, Shelley Winters, Liv Tyler, Debbie Harry, Evan Dando, Joe Grifasi, David Patrick Kelly, Marian Quinn",United States,1995,R,104 min,"Dramas, Independent Movies, Romantic Movies"
328,Movie,Boyka: Undisputed,Todor Chapkanov,"Scott Adkins, Teodora Duhovnikova, Alon Aboutboul, Julian Vergov, Brahim Achabbakhe, Paul Chahidi, Petio Petkov, Valentin Ganev, Vlado Mihailov","Bulgaria, United States",2016,R,90 min,Action & Adventure
332,Movie,Deep Blue Sea,Renny Harlin,"Thomas Jane, Saffron Burrows, Samuel L. Jackson, Jacqueline McKenzie, Michael Rapaport, Stellan Skarsgård, LL Cool J, Aida Turturro, Cristos, Daniel Rey","United States, Mexico",1999,R,105 min,"Action & Adventure, Horror Movies, Sci-Fi & Fantasy"
335,Movie,Freedomland,Joe Roth,"Samuel L. Jackson, Julianne Moore, Edie Falco, Ron Eldard, William Forsythe, Aunjanue Ellis, Anthony Mackie, LaTanya Richardson Jackson, Clarke Peters, Peter Friedman, Domenick Lombardozzi",United States,2006,R,113 min,"Dramas, Thrillers"
337,Movie,Good Luck Chuck,Mark Helfrich,"Dane Cook, Jessica Alba, Dan Fogler, Ellia English, Sasha Pieterse, Annie Wood, Lonny Ross, Chelan Simmons, Simone Bailly, Jodelle Ferland, Crystal Lowe, Troy Gentile, Georgia Craig, Michelle Harrison, Chiara Zanni","United States, Canada",2007,R,99 min,"Comedies, Romantic Movies"
341,Movie,Magnolia,Paul Thomas Anderson,"John C. Reilly, Philip Baker Hall, Tom Cruise, Julianne Moore, Philip Seymour Hoffman, William H. Macy, Jeremy Blackman, Jason Robards, Melinda Dillon, April Grace, Luis Guzmán, Ricky Jay, Alfred Molina, Michael Murphy, Melora Walters",United States,1999,R,189 min,"Dramas, Independent Movies"
346,Movie,Pineapple Express,David Gordon Green,"Seth Rogen, James Franco, Danny McBride, Kevin Corrigan, Craig Robinson, Gary Cole, Rosie Perez, Ed Begley Jr., Nora Dunn, Amber Heard",United States,2008,R,112 min,"Action & Adventure, Comedies"
351,Movie,Team America: World Police,Trey Parker,"Trey Parker, Matt Stone, Kristen Miller, Masasa Moyo, Daran Norris, Phil Hendrie, Maurice LaMarche, Chelsea Magritte, Jeremy Shada, Fred Tatasciore","United States, Germany",2004,R,98 min,"Action & Adventure, Comedies, Cult Movies"
352,Movie,The Edge of Seventeen,Kelly Fremon Craig,"Hailee Steinfeld, Woody Harrelson, Kyra Sedgwick, Haley Lu Richardson, Blake Jenner, Hayden Szeto, Alexander Calvert, Eric Keenleyside","United States, China",2016,R,105 min,"Comedies, Dramas"
353,Movie,The Haunting in Connecticut 2: Ghosts of Georgia,Tom Elkins,"Abigail Spencer, Chad Michael Murray, Katee Sackhoff, Emily Alyn Lind, Cicely Tyson, Andrea Frankle, Brad James, Lance E. Nichols",United States,2013,R,101 min,Horror Movies
354,Movie,The Last Boy Scout,Tony Scott,"Bruce Willis, Damon Wayans, Chelsea Field, Noble Willingham, Taylor Negron, Danielle Harris, Halle Berry, Bruce McGill",United States,1991,R,105 min,"Action & Adventure, Comedies"
355,Movie,The Lincoln Lawyer,Brad Furman,"Matthew McConaughey, Josh Lucas, Ryan Phillippe, John Leguizamo, Michael Peña, Bryan Cranston, Bob Gunton, William H. Macy, Marisa Tomei, Frances Fisher",United States,2011,R,118 min,"Dramas, Thrillers"
357,Movie,The Machinist,Brad Anderson,"Christian Bale, Jennifer Jason Leigh, Aitana Sánchez-Gijón, John Sharian, Michael Ironside, Lawrence Gilliard Jr., Reg E. Cathey, Anna Massey, Matthew Romero, Robert Long, Colin Stinton, Craig Stevenson","Spain, France, United Kingdom, United States",2004,R,102 min,"Dramas, Independent Movies, Thrillers"
359,Movie,The Original Kings of Comedy,Spike Lee,"Steve Harvey, D.L. Hughley, Cedric the Entertainer, Bernie Mac",United States,2000,R,111 min,Stand-Up Comedy
392,Movie,Django Unchained,Quentin Tarantino,"Jamie Foxx, Christoph Waltz, Leonardo DiCaprio, Kerry Washington, Samuel L. Jackson, Walton Goggins, Dennis Christopher, James Remar, David Steen, Dana Gourrier, Nichole Galicia, Laura Cayouette, Ato Essandoh, Sammi Rotibi, Escalante Lundy, Don Johnson",United States,2012,R,165 min,"Action & Adventure, Dramas"
437,Movie,Cosmic Sin,Edward Drake,"Frank Grillo, Bruce Willis, Brandon Thomas Lee, Corey Large, Perrey Reeves, C.J. Perry, Lochlyn Munro, Costas Mandylor, Adelaide Kane, Eva De Dominici, Sarah May Sommers, Trevor Gretzky",United States,2021,R,88 min,Action & Adventure
445,Movie,The Beguiled,Sofia Coppola,"Colin Farrell, Nicole Kidman, Kirsten Dunst, Elle Fanning, Oona Laurence, Angourie Rice, Addison Riecke, Emma Howard",United States,2017,R,94 min,"Dramas, Independent Movies, Thrillers"
474,Movie,American Ultra,Nima Nourizadeh,"Jesse Eisenberg, Kristen Stewart, Topher Grace, Connie Britton, Walton Goggins, John Leguizamo, Bill Pullman, Tony Hale, Lavell Crawford, Stuart Greer","United States, Switzerland",2015,R,96 min,"Action & Adventure, Comedies"
494,Movie,Rock the Kasbah,Barry Levinson,"Bill Murray, Kate Hudson, Zooey Deschanel, Danny McBride, Scott Caan, Leem Lubany, Bruce Willis, Arian Moayed, Taylor Kinney, Glenn Fleshler",United States,2015,R,106 min,"Comedies, Music & Musicals"
558,Movie,6 Bullets,Ernie Barbarash,"Jean-Claude Van Damme, Joe Flanigan, Anna-Louise Plowman, Charlotte Beaumont, Steve Nicolson, Uriel Emil, Louis Dempsey, Mark Lewis, Kristopher Van Varenberg, Bianca Brigitte VanDamme",United States,2012,R,115 min,Action & Adventure
559,Movie,Air Force One,Wolfgang Petersen,"Harrison Ford, Gary Oldman, Glenn Close, Wendy Crewson, Paul Guilfoyle, William H. Macy, Liesel Matthews, Dean Stockwell, Xander Berkeley, Bill Smitrovich, Elya Baskin, David Vadim, Tom Everett, Spencer Garrett, Philip Baker Hall","United States, Germany",1997,R,125 min,Action & Adventure
564,Movie,Boogie Nights,Paul Thomas Anderson,"Mark Wahlberg, Burt Reynolds, Julianne Moore, Heather Graham, William H. Macy, Don Cheadle, Philip Seymour Hoffman, Luis Guzmán, John C. Reilly, Philip Baker Hall",United States,1997,R,155 min,"Comedies, Dramas, Independent Movies"
576,Movie,Mary Magdalene,Garth Davis,"Rooney Mara, Joaquin Phoenix, Chiwetel Ejiofor, Tahar Rahim, Ariane Labed, Denis Ménochet, Lubna Azabal, Tchéky Karyo, Charles Babalola, Tawfeek Barhom, Ryan Corr, Uri Gavriel, Shira Haas, Tsahi Halevi, Michael Moshonov","United Kingdom, Australia, United States",2019,R,120 min,"Dramas, Faith & Spirituality, International Movies"
579,Movie,Midnight Run,Martin Brest,"Robert De Niro, Charles Grodin, Yaphet Kotto, John Ashton, Dennis Farina, Joe Pantoliano, Richard Foronjy, Robert Miranda, Jack Kehoe, Wendy Phillips, Philip Baker Hall",United States,1988,R,126 min,"Action & Adventure, Classic Movies, Comedies"
583,Movie,No Strings Attached,Ivan Reitman,"Natalie Portman, Ashton Kutcher, Kevin Kline, Cary Elwes, Greta Gerwig, Lake Bell, Olivia Thirlby, Ludacris, Jake Johnson, Mindy Kaling, Talia Balsam","United States, United Kingdom",2011,R,109 min,"Comedies, Romantic Movies"
584,Movie,Not Another Teen Movie,Joel Gallen,"Chyler Leigh, Chris Evans, Jaime Pressly, Eric Christian Olsen, Mia Kirshner, Deon Richmond, Eric Jungmann, Ron Lester, Cody McMains, Sam Huntington, Lacey Chabert, JoAnna Garcia Swisher, Samm Levine, Cerina Vincent",United States,2001,R,89 min,Comedies
592,Movie,She's Out of My League,Jim Field Smith,"Jay Baruchel, Alice Eve, T.J. Miller, Mike Vogel, Nate Torrence, Krysten Ritter, Geoff Stults, Lindsay Sloane, Andrew Daly, Jasika Nicole, Kyle Bornheimer",United States,2010,R,106 min,"Comedies, Romantic Movies"
596,Movie,Sword of Trust,Lynn Shelton,"Marc Maron, Jon Bass, Michaela Watkins, Jillian Bell, Toby Huss, Dan Bakkedahl, Lynn Shelton, Whitmer Thomas",United States,2019,R,89 min,"Comedies, Dramas, Independent Movies"
598,Movie,The American,Anton Corbijn,"George Clooney, Violante Placido, Thekla Reuten, Paolo Bonacelli, Johan Leysen, Irina Björklund, Filippo Timi, Anna Foglietta, Björn Granath","United States, United Kingdom",2010,R,105 min,"Dramas, Thrillers"
600,Movie,The Game,David Fincher,"Michael Douglas, Sean Penn, Deborah Kara Unger, James Rebhorn, Peter Donat, Carroll Baker, Anna Katarina, Armin Mueller-Stahl",United States,1997,R,129 min,Thrillers
604,Movie,The Life of David Gale,Alan Parker,"Kevin Spacey, Kate Winslet, Laura Linney, Gabriel Mann, Leon Rippy, Matt Craven, Rhona Mitra, Melissa McCarthy, Jim Beaver, Chris Warner","United Kingdom, Germany, Spain, United States",2003,R,130 min,Dramas
605,Movie,The Long Riders,Walter Hill,"David Carradine, Keith Carradine, Robert Carradine, James Keach, Stacy Keach, Dennis Quaid, Randy Quaid, Kevin Brophy, Harry Carey Jr., Christopher Guest, Nicholas Guest, Shelby Leverington, Felice Orlandi, Pamela Reed, James Remar, Fran Ryan, Savannah Smith Boucher, Amy Stryker, James Whitmore Jr.",United States,1980,R,100 min,Action & Adventure
607,Movie,The Strangers,Bryan Bertino,"Liv Tyler, Scott Speedman, Gemma Ward, Kip Weeks, Laura Margolis, Glenn Howerton, Alex Fisher, Peter Clayton-Luce",United States,2008,R,85 min,"Horror Movies, Thrillers"
610,Movie,Underworld,Len Wiseman,"Kate Beckinsale, Scott Speedman, Michael Sheen, Shane Brolly, Bill Nighy, Erwin Leder, Sophia Myles, Robbie Gee, Wentworth Miller, Kevin Grevioux","United States, United Kingdom, Germany, Hungary",2003,R,121 min,"Action & Adventure, Horror Movies, Sci-Fi & Fantasy"
611,Movie,Underworld: Awakening,"Måns Mårlind, Björn Stein","Kate Beckinsale, Stephen Rea, Michael Ealy, Theo James, India Eisley, Sandrine Holt, Charles Dance, Kris Holden-Ried, Jacob Blair, Adam Greydon Reid","United States, Canada",2012,R,89 min,"Action & Adventure, Horror Movies, Sci-Fi & Fantasy"
612,Movie,Underworld: Rise of the Lycans,Patrick Tatopoulos,"Michael Sheen, Bill Nighy, Rhona Mitra, Steven Mackintosh, Kevin Grevioux, David Aston, Geraldine Brophy, Leighton Cardno, Alex Carroll, Elizabeth Hawthorne, Jason Hood","United States, New Zealand",2009,R,92 min,"Action & Adventure, Horror Movies, Sci-Fi & Fantasy"
615,Movie,Why Do Fools Fall in Love,Gregory Nava,"Halle Berry, Vivica A. Fox, Larenz Tate, Lela Rochon, Little Richard, Paul Mazursky, Pamela Reed, Alexis Cruz",United States,1998,R,116 min,"Dramas, Music & Musicals, Romantic Movies"
622,Movie,Lying and Stealing,Matt Aselton,"Theo James, Emily Ratajkowski, Fred Melamed, Ebon Moss-Bachrach, Isiah Whitlock Jr., Evan Handler, Paul Jurewicz, John Gatins, Fernanda Andrade, Bob Stephenson",United States,2019,R,100 min,Thrillers
630,Movie,Killing Them Softly,Andrew Dominik,"Brad Pitt, Scoot McNairy, Ben Mendelsohn, Richard Jenkins, James Gandolfini, Ray Liotta, Vincent Curatola, Slaine, Max Casella, Trevor Long, Sam Shepard",United States,2012,R,97 min,Dramas
643,Movie,The Seventh Day,Justin P. Lange,"Guy Pearce, Vadhir Derbez, Stephen Lang, Brady Jenness, Chris Galust, Robin Bartlett, Heath Freeman, Keith David",United States,2021,R,87 min,Horror Movies
702,Movie,Silver Linings Playbook,David O. Russell,"Bradley Cooper, Jennifer Lawrence, Robert De Niro, Jacki Weaver, Chris Tucker, Anupam Kher, John Ortiz, Shea Whigham, Julia Stiles, Paul Herman",United States,2012,R,122 min,"Comedies, Dramas, Independent Movies"
718,Movie,Life of Crime,Daniel Schechter,"Jennifer Aniston, Mos Def, Isla Fisher, Will Forte, Mark Boone Junior, Tim Robbins, John Hawkes, Clea Lewis, Charlie Tahan, Kevin Corrigan",United States,2013,R,101 min,"Comedies, Independent Movies"
721,Movie,Rogue Warfare: Death of a Nation,Mike Gunther,"Will Yun Lee, Jermaine Love, Rory Markham, Bertrand-Xavier Corbi, Katie Keene, Fernando Chien, Gina DeCesare, Michael Blalock, Stephen Lang, Chris Mulkey",United States,2020,R,99 min,Action & Adventure
740,Movie,A Haunted House 2,Michael Tiddes,"Marlon Wayans, Jaime Pressly, Essence Atkins, Affion Crockett, Hayes MacArthur, Rick Overton, Ashley Rickards, Cedric the Entertainer, Dave Sheridan, Missi Pyle, Gabriel Iglesias, Steele Stebbins",United States,2014,R,86 min,"Comedies, Horror Movies"
754,Movie,A Private War,Matthew Heineman,"Rosamund Pike, Jamie Dornan, Tom Hollander, Stanley Tucci, Nikki Amuka-Bird, Faye Marsay, Greg Wise, Corey Johnson, Raad Rawi, Jesuthasan Antonythasan","United Kingdom, United States",2018,R,110 min,"Dramas, Independent Movies"
782,Movie,Bliss,Lance Young,"Craig Sheffer, Sheryl Lee, Terence Stamp, Casey Siemaszko, Spalding Gray, Lois Chiles, Blu Mankuma, Ken Camroux-Taylor, Eli Gabay, Molly Parker","Canada, United States",1997,R,103 min,"Dramas, Romantic Movies"
786,Movie,Company of Heroes,Don Michael Paul,"Tom Sizemore, Chad Michael Collins, Vinnie Jones, Dimitri Diatchenko, Neal McDonough, Jürgen Prochnow, Sam Spruell, Richard Sammel, Philip Rham, Alastair Mackenzie",United States,2013,R,101 min,"Action & Adventure, Dramas"
787,Movie,Cradle 2 the Grave,Andrzej Bartkowiak,"Jet Li, DMX, Anthony Anderson, Kelly Hu, Tom Arnold, Mark Dacascos, Gabrielle Union, Michael Jace, Drag-On, Paige Hurd",United States,2003,R,101 min,Action & Adventure
791,Movie,Felon,Ric Roman Waugh,"Stephen Dorff, Val Kilmer, Harold Perrineau, Marisol Nichols, Anne Archer, Nick Chinlund, Nate Parker, Johnny Lewis, Sam Shepard, Jake Walker, Joey Villasenor, Antonio Leyba, Mike Seal, Richard Caruso, Kevin Wiggins, Larnell Stovall, Mara Holguin, Elton Walker, Brittany Perrineau, Esodie Geiger, Jermaine Washington, Greg Serano, Brian Keith Gamble, Mark Sivertsen, Carrie Fleming, Adam Taylor, Chris Browning, John Koyama, Shawn Prince, Christopher Dempsey, Cynthia Ruffin",United States,2008,R,104 min,"Action & Adventure, Dramas"
796,Movie,Hostel: Part III,Scott Spiegel,"Kip Pardue, Brian Hallisay, John Hensley, Sarah Habel, Chris Coy, Skyler Stone, Thomas Kretschmann, Zulay Henao, Nickola Shreli, Derrick Carr",United States,2011,R,88 min,"Cult Movies, Horror Movies"
798,Movie,Love Jones,Theodore Witcher,"Larenz Tate, Nia Long, Isaiah Washington, Lisa Nicole Carson, Bill Bellamy, Leonard Roberts, Bernadette L. Clarke, Khalil Kain",United States,1997,R,109 min,"Comedies, Dramas, Independent Movies"
801,Movie,Never Back Down 2: The Beatdown,Michael Jai White,"Michael Jai White, Dean Geyer, Alex Meraz, Todd Duffee, Scottie Epstein, Jillian Murray, Evan Peters, Stacey Asaro, Gralen Bryant Banks, Rus Blackwell",United States,2011,R,104 min,"Action & Adventure, Dramas, Sports Movies"
802,Movie,Ninja Assassin,James McTeigue,"Rain, Naomie Harris, Ben Miles, Rick Yune, Shô Kosugi, Sung Kang, Richard van Weyden, Thorston Manderlay, Wladimir Tarasjanz, Eleonore Weisgerber","Germany, United States, France",2009,R,99 min,Action & Adventure
804,Movie,Population 436,Michelle MacLaren,"Jeremy Sisto, Fred Durst, Charlotte Sullivan, David Ames, Cory Cassidy, James Blicq, Martin Trudel, Reva Timbers, Rick Skene, Peter Outerbridge, Dana Horrox","Canada, United States",2006,R,93 min,"Horror Movies, Thrillers"
808,Movie,Sniper: Legacy,Don Michael Paul,"Tom Berenger, Chad Michael Collins, Doug Allen, Dominic Mafham, Mercedes Mason, Mark Lewis Jones, Nestor Serrano, Dennis Haysbert, Alex Roe, Yana Marinova","United States, Bulgaria",2014,R,98 min,Action & Adventure
812,Movie,Swordfish,Dominic Sena,"John Travolta, Hugh Jackman, Halle Berry, Don Cheadle, Sam Shepard, Vinnie Jones, Drea de Matteo, Rudolf Martin, Zach Grenier, Camryn Grimes",United States,2001,R,99 min,Action & Adventure
822,Movie,The Wind,Emma Tammi,"Caitlin Gerard, Julia Goldani Telles, Ashley Zukerman, Miles Anderson, Dylan McTee",United States,2019,R,88 min,Horror Movies
824,Movie,Welcome Home,George Ratliff,"Aaron Paul, Emily Ratajkowski, Riccardo Scamarcio, Katy Louise Saunders, Alice Bellagamba",United States,2018,R,97 min,Thrillers
853,Movie,Army of the Dead,Zack Snyder,"Dave Bautista, Ella Purnell, Omari Hardwick, Garret Dillahunt, Ana de la Reguera, Theo Rossi, Matthias Schweighöfer, Nora Arnezeder, Hiroyuki Sanada, Tig Notaro, Raúl Castillo, Huma Qureshi, Samantha Win, Richard Cetrone, Michael Cassidy",United States,2021,R,148 min,"Action & Adventure, Horror Movies"
865,Movie,Sabotage,David Ayer,"Arnold Schwarzenegger, Sam Worthington, Olivia Williams, Terrence Howard, Joe Manganiello, Josh Holloway, Mireille Enos, Harold Perrineau, Martin Donovan, Max Martini, Mark Schlegel, Kevin Vance",United States,2014,R,109 min,"Action & Adventure, Dramas"
866,Movie,Small Town Crime,"Eshom Nelms, Ian Nelms","John Hawkes, Anthony Anderson, Octavia Spencer, Robert Forster, Clifton Collins Jr., Jeremy Ratchford, James Lafferty, Michael Vartan, Daniel Sunjata, Don Harvey, Stefanie Scott, Caity Lotz, Dale Dickey",United States,2017,R,92 min,Thrillers
872,Movie,Sleight,J.D. Dillard,"Jacob Latimore, Seychelle Gabriel, Sasheer Zamata, Storm Reid, Cameron Esposito, Dulé Hill, Michael Villar, Brandon Johnson, Donzaleigh Abernathy, Jay Walker",United States,2016,R,89 min,"Dramas, Independent Movies, Sci-Fi & Fantasy"
889,Movie,The Woman in the Window,Joe Wright,"Amy Adams, Gary Oldman, Anthony Mackie, Fred Hechinger, Wyatt Russell, Brian Tyree Henry, Jennifer Jason Leigh, Jeanine Serralles, Mariah Bozeman, Julianne Moore",United States,2021,R,102 min,"Dramas, Thrillers"
904,Movie,Sleepless,Baran bo Odar,"Jamie Foxx, Michelle Monaghan, Scoot McNairy, Dermot Mulroney, T.I., David Harbour, Gabrielle Union, Octavius J. Johnson, Tim Connolly, Drew Sheer",United States,2017,R,95 min,Action & Adventure
916,Movie,Dead Man Down,Niels Arden Oplev,"Colin Farrell, Noomi Rapace, Terrence Howard, Dominic Cooper, Isabelle Huppert, Luis Da Silva Jr., Armand Assante, F. Murray Abraham",United States,2013,R,118 min,Action & Adventure
926,Movie,Au coeur des gangs,Vondie Curtis-Hall,"Tyrese Gibson, Meagan Good, Larenz Tate, Henry Hunter Hall, Kimora Lee Simmons, Game",United States,2006,R,97 min,"Action & Adventure, Dramas"
930,Movie,Due Date,Todd Phillips,"Robert Downey Jr., Zach Galifianakis, Michelle Monaghan, Jamie Foxx, Juliette Lewis, Danny McBride, RZA, Matt Walsh",United States,2010,R,95 min,"Action & Adventure, Comedies"
932,Movie,Green Zone,Paul Greengrass,"Matt Damon, Greg Kinnear, Brendan Gleeson, Amy Ryan, Khalid Abdalla, Jason Isaacs, Said Faraj, Michael O'Neill, Igal Naor, Raad Rawi","United Kingdom, France, Spain, United States",2010,R,115 min,Action & Adventure
934,Movie,JT LeRoy,Justin Kelly,"Kristen Stewart, Laura Dern, Jim Sturgess, Diane Kruger, Kelvin Harrison Jr., James Jagger, Courtney Love, David Brown","United Kingdom, Canada, United States",2018,R,109 min,"Dramas, Independent Movies"
