,type,title,director,cast,country,release_year,rating,duration,listed_in
5344,Movie,Message from the King,Fabrice Du Welz,"Chadwick Boseman, Luke Evans, Teresa Palmer, Alfred Molina, Natalie Martinez, Tom Felton, Dale Dickey, Sibongile Mlambo","United Kingdom, France, Belgium, United States",2017,R,103 min,"Independent Movies, Thrillers"
5516,Movie,Shepherds and Butchers,Oliver Schmitz,"Steve Coogan, Andrea Riseborough, Garion Dowds, Robert Hobbs, Deon Lotz, Marcel Van Heerden, Lauren Steyn","South Africa, United States, Germany",2016,R,106 min,"Dramas, International Movies"
5535,Movie,Kevin Hart: What Now?,Leslie Small,"Kevin Hart, Don Cheadle, Halle Berry, Ed Helms, David Meunier",United States,2016,R,96 min,Stand-Up Comedy
5852,Movie,Hush,Mike Flanagan,"John Gallagher Jr., Kate Siegel, Michael Trucco, Samantha Sloyan, Emma Graves",United States,2016,R,82 min,"Horror Movies, Thrillers"
5889,Movie,Results,Andrew Bujalski,"Guy Pearce, Cobie Smulders, Kevin Corrigan, Giovanni Ribisi, Anthony Michael Hall, Brooklyn Decker, Constance Zimmer, Tishuan Scott",United States,2015,R,105 min,"Comedies, Independent Movies"
5903,Movie,Creep,Patrick Brice,"Mark Duplass, Patrick Brice",United States,2014,R,78 min,"Horror Movies, Independent Movies, Thrillers"
5960,Movie,187,Kevin Reynolds,"Samuel L. Jackson, John Heard, Kelly Rowan, Clifton Collins Jr., Tony Plana",United States,1997,R,119 min,Dramas
5965,Movie,22-Jul,Paul Greengrass,"Anders Danielsen Lie, Jon Øigarden, Jonas Strand Gravli, Ola G. Furuseth, Maria Bock, Thorbjørn Harr, Jaden Smith","Norway, Iceland, United States",2018,R,144 min,"Dramas, Thrillers"
5987,Movie,13 Cameras,Victor Zarcoff,"PJ McCabe, Brianne Moncrief, Sarah Baldwin, Jim Cummings, Heidi Niedermeyer, Neville Archambault",United States,2015,NR,90 min,"Horror Movies, Independent Movies, Thrillers"
5988,Movie,13 Sins,Daniel Stamm,"Mark Webber, Rutina Wesley, Devon Graye, Tom Bower, Ron Perlman, Pruitt Taylor Vince",United States,2014,R,93 min,"Horror Movies, Thrillers"
5999,Movie,20th Century Women,Mike Mills,"Annette Bening, Elle Fanning, Greta Gerwig, Lucas Jade Zumann, Billy Crudup",United States,2016,R,119 min,"Dramas, Independent Movies"
6000,Movie,21 & Over,"Jon Lucas, Scott Moore","Miles Teller, Skylar Astin, Justin Chon, Sarah Wright, Jonathan Keltz, François Chau, Russell Hodgkinson, Daniel Booko, Russell Mercado, Josie Loren, Dustin Ybarra",United States,2013,R,93 min,Comedies
6003,Movie,24 Hours to Live,Brian Smrz,"Ethan Hawke, Xu Qing, Paul Anderson, Rutger Hauer, Tyrone Keogh, Nathalie Boltt, Liam Cunningham","South Africa, China, United States",2017,R,93 min,Action & Adventure
6012,Movie,30 Minutes or Less,Ruben Fleischer,"Jesse Eisenberg, Danny McBride, Aziz Ansari, Nick Swardson, Dilshad Vadsaria, Michael Peña, Bianca Kajlich, Fred Ward",United States,2011,R,83 min,"Action & Adventure, Comedies"
6015,Movie,4th Man Out,Andrew Nackman,"Evan Todd, Parker Young, Chord Overstreet, Jon Gabrus, Kate Flannery, Brooke Dillman, Jennifer Damiano, Jordan Lane Price, Alex Rennie, Jake Epstein",United States,2015,NR,86 min,"Comedies, LGBTQ Movies"
6017,Movie,5 to 7,Victor Levin,"Anton Yelchin, Bérénice Marlohe, Olivia Thirlby, Lambert Wilson, Frank Langella, Glenn Close",United States,2014,R,97 min,"Comedies, Dramas, Romantic Movies"
6019,Movie,50/50,Jonathan Levine,"Joseph Gordon-Levitt, Seth Rogen, Anna Kendrick, Bryce Dallas Howard, Anjelica Huston, Serge Houde, Andrew Airlie, Matt Frewer, Philip Baker Hall, Marie Avgeropoulos, Jessica Parker Kennedy",United States,2011,R,100 min,"Comedies, Dramas, Independent Movies"
6023,Movie,68 Kill,Trent Haaga,"Matthew Gray Gubler, AnnaLynne McCord, Alisha Boe, Sheila Vand, Sam Eidson, James Moses Black, Ajay Mehta, Michael Beasley, David Maldonado, Hallie Grace Bradley, Peter Jaymes Jr., Eric Podnar, Lucy Faust",United States,2017,R,96 min,"Comedies, Independent Movies, Thrillers"
6027,Movie,A Bad Moms Christmas,"Jon Lucas, Scott Moore","Mila Kunis, Kristen Bell, Kathryn Hahn, Susan Sarandon, Christine Baranski, Jay Hernandez, Cheryl Hines, Peter Gallagher, Justin Hartley","United States, China",2017,R,104 min,Comedies
6031,Movie,A Clockwork Orange,Stanley Kubrick,"Malcolm McDowell, Patrick Magee, Michael Bates, Warren Clarke, Adrienne Corri, Paul Farrell, Miriam Karlin, James Marcus","United Kingdom, United States",1971,R,137 min,"Classic Movies, Cult Movies, Dramas"
6032,Movie,A Dangerous Woman,Stephen Gyllenhaal,"Debra Winger, Barbara Hershey, Gabriel Byrne, Laurie Metcalf, John Terry, Maggie Gyllenhaal, Jake Gyllenhaal, Chloe Webb, David Strathairn",United States,1993,R,101 min,"Dramas, Romantic Movies"
6034,Movie,A Family Man,Mark Williams,"Gerard Butler, Gretchen Mol, Alison Brie, Willem Dafoe, Alfred Molina, Maxwell Jenkins, Anupam Kher, Dustin Milligan","Canada, United States",2016,R,110 min,Dramas
6036,Movie,A Glimpse Inside the Mind of Charles Swan III,Roman Coppola,"Charlie Sheen, Jason Schwartzman, Bill Murray, Katheryn Winnick, Patricia Arquette, Aubrey Plaza, Mary Elizabeth Winstead, Dermot Mulroney",United States,2012,R,86 min,"Comedies, Independent Movies"
6039,Movie,A Haunted House,Michael Tiddes,"Marlon Wayans, Essence Atkins, Cedric the Entertainer, Nick Swardson, David Koechner, Dave Sheridan, Affion Crockett, J.B. Smoove, Andrew Daly, Alanna Ubach",United States,2013,R,86 min,"Comedies, Horror Movies"
6042,Movie,A Kind of Murder,Andy Goddard,"Patrick Wilson, Jessica Biel, Vincent Kartheiser, Haley Bennett, Eddie Marsan, Jon Osbeck, Radek Lord, Christine Dye",United States,2016,R,96 min,Thrillers
6046,Movie,A Most Violent Year,J.C. Chandor,"Oscar Isaac, Jessica Chastain, David Oyelowo, Albert Brooks, Elyes Gabel, Catalina Sandino Moreno, Christopher Abbott, Peter Gerety, Alessandro Nivola","United Arab Emirates, United States",2014,R,125 min,"Dramas, Thrillers"
6052,Movie,A Perfect Man,Kees Van Oostrum,"Liev Schreiber, Jeanne Tripplehorn, Joelle Carter, Louise Fletcher, Katie Carr, Renée Soutendijk, Huub Stapel, Michael Pas",United States,2013,R,94 min,"Dramas, Independent Movies, Romantic Movies"
6057,Movie,A Serious Man,"Ethan Coen, Joel Coen","Michael Stuhlbarg, Richard Kind, Fred Melamed, Sari Lennick, Adam Arkin, Amy Landecker, Alan Mandell, Fyvush Finkel, Peter Breitmayer, Aaron Wolff, Jessica McManus, Brent Braunschweig","United States, United Kingdom, France",2009,R,106 min,"Comedies, Independent Movies"
6060,Movie,A Thin Line Between Love & Hate,Martin Lawrence,"Martin Lawrence, Lynn Whitfield, Regina King, Bobby Brown, Della Reese, Daryl Mitchell, Roger Mosley, Malinda Williams, Roger E. Mosley, Simbi Khali, Tangie Ambrose, Wendy Raquel Robinson, Stacii Jae Johnson, Faizon Love, Miguel A. Núñez Jr., Tracy Morgan",United States,1996,R,108 min,"Comedies, Romantic Movies"
6086,Movie,Act of Valor,"Mike McCoy, Scott Waugh","Keo Woolford, Drea Castro, Emilio Rivera, Rorke Denver, Jason Cottle, Ailsa Marshall, Alex Veadov, Dave, Roselyn Sanchez, Thomas Rosales Jr., Nestor Serrano, Gonzalo Menendez",United States,2012,R,110 min,Action & Adventure
6087,Movie,Act of Vengeance,Mahsun Kırmızıgül,"Haluk Bilginer, Mahsun Kırmızıgül, Mustafa Sandal, Gina Gershon, Robert Patrick, Danny Glover, Engin Altan Düzyatan, Scott William Winters, Sharrieff Pugh","Turkey, United States",2010,NR,112 min,"Action & Adventure, International Movies"
6093,Movie,Adventures in Public School,Kyle Rideout,"Daniel Doheny, Judy Greer, Siobhan Williams, Russell Peters, Grace Park, Andrew McNee, Alex Barima, Andrew Herr, Eva Day, Josh Epstein","Canada, United States",2018,NR,86 min,Comedies
6098,Movie,Aftershock,Nicolás López,"Eli Roth, Andrea Osvárt, Ariel Levy, Natasha Yarovenko, Nicolás Martínez, Lorenza Izzo, Marcial Tagle, Ramón Llao, Ignacia Allamand, Paz Bascuñán","United States, Chile",2012,R,89 min,"Action & Adventure, Horror Movies"
6104,Movie,Ai Weiwei: Never Sorry,Alison Klayman,"Ai Weiwei, Lao Ai",United States,2012,R,91 min,Documentaries
6115,Movie,All About Nina,Eva Vives,"Mary Elizabeth Winstead, Common, Kate del Castillo, Chace Crawford, Jay Mohr, Beau Bridges, Clea DuVall, Melonie Diaz, Camryn Manheim, Mindy Sterling, Angelique Cabral, Nicole Byer, Todd Louiso, Elizabeth Masucci, Sonoya Mizuno, Charlotte Newhouse, Victor Rasuk, Andree Vermeulen",United States,2018,R,101 min,"Comedies, Dramas, Independent Movies"
6120,Movie,All the Boys Love Mandy Lane,Jonathan Levine,"Anson Mount, Edwin Hodge, Michael Welch, Brooke Bloom, Amber Heard, Aaron Himelstein, Whitney Able, Luke Grimes, Melissa Price",United States,2006,R,91 min,Horror Movies
6123,Movie,Along Came a Spider,Lee Tamahori,"Morgan Freeman, Monica Potter, Michael Wincott, Dylan Baker, Mika Boorem, Anton Yelchin, Kim Hawthorne, Jay O. Sanders, Billy Burke, Michael Moriarty, Penelope Ann Miller","United States, Germany, Canada",2001,R,103 min,Thrillers
6134,Movie,American Assassin,Michael Cuesta,"Dylan O'Brien, Michael Keaton, Sanaa Lathan, Shiva Negar, Taylor Kitsch, Trevor White, Navid Negahban, Scott Adkins, David Suchet, Sydney Rae White",United States,2017,R,112 min,Action & Adventure
6135,Movie,American Beauty,Sam Mendes,"Kevin Spacey, Annette Bening, Thora Birch, Wes Bentley, Mena Suvari, Chris Cooper, Peter Gallagher, Allison Janney, Scott Bakula, Sam Robards",United States,1999,R,122 min,Dramas
6143,Movie,American History X,Tony Kaye,"Edward Norton, Edward Furlong, Beverly D'Angelo, Jennifer Lien, Ethan Suplee, Fairuza Balk, Avery Brooks, Elliott Gould, Stacy Keach, William Russ, Guy Torry",United States,1998,R,119 min,Dramas
6144,Movie,American Honey,Andrea Arnold,"Sasha Lane, Shia LaBeouf, Riley Keough, McCaul Lombardi, Arielle Holmes","United Kingdom, United States",2016,R,163 min,"Dramas, Independent Movies"
6147,Movie,American Psycho,Mary Harron,"Christian Bale, Willem Dafoe, Jared Leto, Reese Witherspoon, Samantha Mathis, Chloë Sevigny, Justin Theroux, Josh Lucas, Matt Ross, Bill Sage, Cara Seymour, Guinevere Turner","United States, Canada",2000,R,102 min,"Comedies, Cult Movies, Dramas"
6162,Movie,Anesthesia,Tim Blake Nelson,"Sam Waterston, Tim Blake Nelson, Jessica Hecht, Kristen Stewart, Corey Stoll, K. Todd Freeman, Glenn Close, Gretchen Mol, Michael Kenneth Williams, Gloria Reuben, Mickey Sumner, Yul Vazquez, Hannah Marks, Ben Konigsberg",United States,2015,R,90 min,"Dramas, Independent Movies"
6163,Movie,Angel Eyes,Luis Mandoki,"Jennifer Lopez, Jim Caviezel, Sonia Braga, Terrence Howard, Jeremy Sisto, Monet Mazur, Victor Argo, Shirley Knight",United States,2001,R,103 min,"Dramas, Romantic Movies"
6179,Movie,APEX: The Story of the Hypercar,"J.F. Musial, Josh Vietze",Zachary Levi,United States,2016,NR,86 min,Documentaries
6187,Movie,"As Above, So Below",John Erick Dowdle,"Perdita Weeks, Ben Feldman, Edwin Hodge, François Civil, Marion Lambert, Ali Marhyar, Cosme Castro, Hamid Djavadan, Théo Cholbi, Emy Lévy",United States,2014,R,93 min,"Horror Movies, Thrillers"
6199,Movie,Automata,Gabe Ibáñez,"Antonio Banderas, Dylan McDermott, Melanie Griffith, Birgitte Hjort Sørensen, Robert Forster, Christa Campbell, Tim McInnerny, Andy Nyman, David Ryall","Bulgaria, United States, Spain, Canada",2014,R,110 min,"International Movies, Sci-Fi & Fantasy, Thrillers"
6205,Movie,Babel,Alejandro G. Iñárritu,"Brad Pitt, Cate Blanchett, Gael García Bernal, Koji Yakusho, Adriana Barraza, Rinko Kikuchi, Said Tarchani, Boubker Ait El Caid, Elle Fanning, Nathan Gamble, Mohamed Akhzam","France, United States, Mexico",2006,R,143 min,"Dramas, Independent Movies"
6211,Movie,Bad Boys,Michael Bay,"Will Smith, Martin Lawrence, Téa Leoni, Tchéky Karyo, Theresa Randle, Joe Pantoliano, Emmanuel Xuereb, Michael Imperioli, Nestor Serrano, Julio Oscar Mechoso",United States,1995,R,119 min,"Action & Adventure, Comedies"
6212,Movie,Bad Boys II,Michael Bay,"Will Smith, Martin Lawrence, Jordi Mollà, Gabrielle Union, Peter Stormare, Theresa Randle, Joe Pantoliano, Michael Shannon, Jon Seda, Yul Vazquez",United States,2003,R,147 min,"Action & Adventure, Comedies"
6225,Movie,Band Aid,Zoe Lister-Jones,"Zoe Lister-Jones, Adam Pally, Fred Armisen, Susie Essman, Retta, Hannah Simone, Brooklyn Decker, Angelique Cabral, Colin Hanks, Ravi V. Patel, Jamie Chung, Erinn Hayes, Gillian Zinser, Jesse Williams",United States,2017,R,94 min,"Comedies, Dramas, Independent Movies"
6226,Movie,Band of Robbers,"Aaron Nee, Adam Nee","Kyle Gallner, Adam Nee, Matthew Gray Gubler, Melissa Benoist, Hannibal Buress, Eric Christian Olsen, Stephen Lang, Daniel Edward Mora, Johnny Pemberton, Cooper Huckabee, Lee Garlington, Beth Grant, Creed Bratton",United States,2015,NR,95 min,"Action & Adventure, Comedies, Independent Movies"
6247,Movie,BASEketball,David Zucker,"Trey Parker, Matt Stone, Dian Bachar, Yasmine Bleeth, Jenny McCarthy, Ernest Borgnine, Robert Vaughn, Trevor Einhorn",United States,1998,R,103 min,"Comedies, Sports Movies"
6248,Movie,Basic Instinct,Paul Verhoeven,"Michael Douglas, Sharon Stone, George Dzundza, Jeanne Tripplehorn, Denis Arndt, Leilani Sarelle, Bruce A. Young, Chelcie Ross, Dorothy Malone, Wayne Knight, Daniel von Bargen, Stephen Tobolowsky","United States, France",1992,R,128 min,"Classic Movies, Thrillers"
6306,Movie,Big Kill,Scott Martin,"Christoph Sanders, Jason Patric, Clint Glenn Hummel, Lou Diamond Phillips, Danny Trejo, Scott Martin, Elizabeth McLaughlin, Stephanie Beran, K.C. Clyde, Michael Paré",United States,2018,R,126 min,Action & Adventure
6310,Movie,Bill Burr: Let It Go,Shannon Hartman,Bill Burr,United States,2010,NR,65 min,Stand-Up Comedy
6316,Movie,Bitch,Marianna Palka,"Jason Ritter, Jaime King, Marianna Palka, Brighton Sharbino, Rio Mangini, Jason Maybaum, Kingston Foster, Arielle Kebbel, Martin Starr, Roger Guenveur Smith, Caroline Aaron, Bill Smitrovich",United States,2017,R,97 min,"Comedies, Dramas, Independent Movies"
6322,Movie,Black Hawk Down,Ridley Scott,"Josh Hartnett, Ewan McGregor, Tom Sizemore, Eric Bana, William Fichtner, Ewen Bremner, Sam Shepard, Gabriel Casseus, Kim Coates, Hugh Dancy, Ron Eldard, Ioan Gruffudd, Tom Guiry, Charlie Hofheimer, Danny Hoch, Jason Isaacs, Zeljko Ivanek, Glenn Morshower, Jeremy Piven, Brendan Sexton III","United States, United Kingdom",2001,R,144 min,"Action & Adventure, Dramas"
6327,Movie,Black Snake Moan,Craig Brewer,"Samuel L. Jackson, Christina Ricci, Justin Timberlake, S. Epatha Merkerson, John Cothran, David Banner, Michael Raymond-James, Adriane Lenox, Kim Richards, Neimus K. Williams",United States,2007,R,116 min,"Dramas, Independent Movies"
6331,Movie,Blaze,Ethan Hawke,"Benjamin Dickey, Alia Shawkat, Josh Hamilton, Charlie Sexton, Sam Rockwell, Wyatt Russell, Steve Zahn, Kris Kristofferson, Richard Linklater, David Kallaway, Ritchie Montgomery",United States,2018,R,129 min,"Dramas, Independent Movies, Music & Musicals"
6332,Movie,Bleed for This,Ben Younger,"Miles Teller, Aaron Eckhart, Katey Sagal, Ciarán Hinds, Ted Levine, Jordan Gelber, Amanda Clayton, Daniel Sauli, Christine Evangelista, Tina Casciani",United States,2016,R,120 min,"Dramas, Sports Movies"
6337,Movie,Blow,Ted Demme,"Johnny Depp, Penélope Cruz, Franka Potente, Rachel Griffiths, Paul Reubens, Jordi Mollà, Cliff Curtis, Miguel Sandoval, Ethan Suplee, Ray Liotta",United States,2001,R,123 min,Dramas
6340,Movie,Blue Mountain State: The Rise of Thadland,Lev L. Spiro,"Alan Ritchson, Darin Brooks, James Cade, Rob Ramsay, Chris Romano, Frankie Shaw, Omari Newton, Ed Marinaro, Dhani Jones, Ed Amatrudo, Jimmy Tatro",United States,2016,R,90 min,Comedies
6342,Movie,Blue Ruin,Jeremy Saulnier,"Macon Blair, Devin Ratray, Amy Hargreaves, Kevin Kolack, Eve Plumb, David W. Thompson, Brent Werzner, Stacy Rock, Sidné Anderson, Sandy Barnett, Bonnie Johnson","United States, France",2013,R,90 min,"Independent Movies, Thrillers"
6344,Movie,Blue Valentine,Derek Cianfrance,"Ryan Gosling, Michelle Williams, Faith Wladyka, John Doman, Mike Vogel, Ben Shenkman, Jen Jones, Maryann Plunkett, Marshall Johnson, James Benatti, Barbara Troy, Carey Westbrook, Enid Graham",United States,2010,R,112 min,"Dramas, Independent Movies, Romantic Movies"
6358,Movie,Bonnie and Clyde,Arthur Penn,"Warren Beatty, Faye Dunaway, Michael J. Pollard, Gene Hackman, Estelle Parsons, Denver Pyle, Dub Taylor, Evans Evans, Gene Wilder",United States,1967,R,111 min,"Action & Adventure, Classic Movies, Dramas"
6376,Movie,Brick,Rian Johnson,"Joseph Gordon-Levitt, Nora Zehetner, Lukas Haas, Noah Fleiss, Matt O'Leary, Emilie de Ravin, Noah Segan, Richard Roundtree, Meagan Good, Brian White",United States,2005,R,110 min,"Independent Movies, Thrillers"
6379,Movie,Brooklyn's Finest,Antoine Fuqua,"Richard Gere, Don Cheadle, Ethan Hawke, Wesley Snipes, Will Patton, Lili Taylor, Michael Kenneth Williams, Brían F. O'Byrne, Shannon Kane, Ellen Barkin, Vincent D'Onofrio, Logan Marshall-Green",United States,2009,R,133 min,"Dramas, Thrillers"
6397,Movie,Cabin Fever,Travis Zariwny,"Gage Golightly, Matthew Daddario, Samuel Davis, Nadine Crocker, Dustin Ingram, Randy Schulman",United States,2016,R,98 min,"Horror Movies, Thrillers"
6412,Movie,Camp X-Ray,Peter Sattler,"Kristen Stewart, Peyman Moaadi, John Carroll Lynch, Lane Garrison, Joseph Julian Soria, Ser'Darius Blain, Cory Michael Smith, Julia Duffy",United States,2014,R,117 min,"Dramas, Independent Movies"
6415,Movie,Candyman,Bernard Rose,"Virginia Madsen, Tony Todd, Xander Berkeley, Kasi Lemmons, Vanessa Williams, DeJuan Guy, Michael Culkin, Stanley DeSantis","United States, United Kingdom",1992,R,99 min,"Cult Movies, Horror Movies"
6422,Movie,Carol,Todd Haynes,"Cate Blanchett, Rooney Mara, Sarah Paulson, Kyle Chandler, Jake Lacy, John Magaro, Cory Michael Smith, Carrie Brownstein, Kevin Crowley, Nik Pajic","United Kingdom, United States, Australia",2015,R,119 min,"Dramas, LGBTQ Movies, Romantic Movies"
6423,Movie,Carrie,Brian De Palma,"Sissy Spacek, Piper Laurie, Amy Irving, William Katt, John Travolta, Nancy Allen, Betty Buckley, P.J. Soles, Priscilla Pointer, Sydney Lassick, Stefan Gierasch, Michael Talbott, Doug Cox, Harry Gold, Noelle North",United States,1976,R,98 min,"Classic Movies, Cult Movies, Horror Movies"
6425,Movie,Casa de mi Padre,Matt Piedmont,"Will Ferrell, Gael García Bernal, Diego Luna, Genesis Rodriguez, Pedro Armendáriz Jr., Nick Offerman, Efren Ramirez, Adrian Martinez","United States, Mexico",2012,R,84 min,Comedies
6431,Movie,Cat on a Hot Tin Roof,Richard Brooks,"Elizabeth Taylor, Paul Newman, Burl Ives, Jack Carson, Judith Anderson, Madeleine Sherwood, Larry Gates, Vaughn Taylor",United States,1958,NR,108 min,"Classic Movies, Dramas"
6450,Movie,Chasing Amy,Kevin Smith,"Ben Affleck, Joey Lauren Adams, Jason Lee, Dwight Ewell, Jason Mewes, Kevin Smith",United States,1997,R,113 min,"Comedies, Cult Movies, Dramas"
6458,Movie,Chernobyl Diaries,Bradley Parker,"Ingrid Bolsø Berdal, Dimitri Diatchenko, Olivia Taylor Dudley, Devin Kelley, Jesse McCartney, Nathan Phillips, Jonathan Sadowski, Alex Feldman, Kristof Konrad, Pasha D. Lychnikoff",United States,2012,R,88 min,"Horror Movies, Thrillers"
6468,Movie,Child's Play,Tom Holland,"Catherine Hicks, Alex Vincent, Brad Dourif, Chris Sarandon, Dinah Manoff, Tommy Swerdlow, Jack Colvin, Neil Giuntoli, Juan Ramírez, Alan Wilder",United States,1988,R,87 min,"Cult Movies, Horror Movies"
6472,Movie,Chittagong,Bedabrata Pain,"Manoj Bajpayee, Barry John, Delzad Hiwale, Vega Tamotia, Nawazuddin Siddiqui, Rajkummar Rao, Jaideep Ahlawat, Vijay Varma, Dibyendu Bhattacharya","United States, India, Bangladesh",2012,NR,105 min,"Dramas, Independent Movies, International Movies"
6474,Movie,Chloe,Atom Egoyan,"Julianne Moore, Liam Neeson, Amanda Seyfried, Max Thieriot, R.H. Thomson, Nina Dobrev, Laura de Carteret, Mishu Vellani","United States, Canada, France",2009,R,96 min,"Independent Movies, Thrillers"
6500,Movie,Closed Circuit,John Crowley,"Eric Bana, Rebecca Hall, Ciarán Hinds, Riz Ahmed, Anne-Marie Duff, Kenneth Cranham, Julia Stiles, Jim Broadbent, Denis Moschitto, Barbora Bobulova, Jemma Powell","United Kingdom, United States",2013,R,96 min,"Dramas, Thrillers"
6501,Movie,Cloud Atlas,"Lilly Wachowski, Lana Wachowski, Tom Tykwer","Tom Hanks, Halle Berry, Jim Broadbent, Hugo Weaving, Jim Sturgess, Doona Bae, Ben Whishaw, Keith David, James D'Arcy, Zhou Xun","Germany, United States, Hong Kong, Singapore",2012,R,172 min,"Action & Adventure, Cult Movies, Dramas"
6516,Movie,Colonia,Florian Gallenberger,"Emma Watson, Daniel Brühl, Michael Nyqvist, Richenda Carey, Vicky Krieps, Jeanne Werner, Julian Ovenden, August Zirner, Martin Wuttke, Stefan Merki","Germany, France, Luxembourg, United Kingdom, United States",2015,R,110 min,"Dramas, Independent Movies, International Movies"
6518,Movie,Come and Find Me,Zack Whedon,"Aaron Paul, Annabelle Wallis, Garret Dillahunt, Chris Chalk, Zachary Knighton, Enver Gjokaj, Michael Kopsa, Terry Chen","Canada, United States, United Kingdom",2016,R,112 min,"Dramas, Thrillers"
6526,Movie,Concussion,Stacie Passon,"Robin Weigert, Maggie Siff, Johnathan Tchaikovsky, Ben Shenkman, Janel Moloney, Emily Kinney",United States,2013,R,96 min,"Dramas, Independent Movies, LGBTQ Movies"
6540,Movie,Crash,Paul Haggis,"Sandra Bullock, Don Cheadle, Matt Dillon, Jennifer Esposito, William Fichtner, Brendan Fraser, Terrence Howard, Ludacris, Thandie Newton, Ryan Phillippe, Larenz Tate, Nona Gaye, Michael Peña","United States, Germany",2004,R,112 min,"Dramas, Independent Movies"
6544,Movie,Cult of Chucky,Don Mancini,"Fiona Dourif, Michael Therriault, Adam Hurtig, Alex Vincent, Jennifer Tilly, Brad Dourif, Summer H. Howell, Grace Lynn Kung, Elisabeth Rosen, Zak Santiago, Ali Tataryn",United States,2017,R,90 min,Horror Movies
6545,Movie,Cutie and the Boxer,Zachary Heinzerling,"Noriko Shinohara, Ushio Shinohara",United States,2013,R,82 min,Documentaries
6555,Movie,Dallas Buyers Club,Jean-Marc Vallée,"Matthew McConaughey, Jennifer Garner, Jared Leto, Denis O'Hare, Steve Zahn, Michael O'Neill, Dallas Roberts, Griffin Dunne, Kevin Rankin, Donna DuPlantier",United States,2013,R,117 min,"Dramas, Independent Movies, LGBTQ Movies"
6565,Movie,Dark Crimes,Alexandros Avranas,"Jim Carrey, Marton Csokas, Charlotte Gainsbourg, Agata Kulesza, Kati Outinen, Zbigniew Zamachowski, Danuta Kowalska, Vlad Ivanov, Robert Więckiewicz, Piotr Głowacki","United Kingdom, Poland, United States",2016,R,93 min,"Dramas, Thrillers"
6566,Movie,Dark Places,Gilles Paquet-Brenner,"Charlize Theron, Nicholas Hoult, Chloë Grace Moretz, Tye Sheridan, Sterling Jerins, Corey Stoll, Christina Hendricks, Drea de Matteo, Sean Bridgers, Andrea Roth","United States, United Kingdom, France",2015,R,113 min,"Dramas, International Movies, Thrillers"
6570,Movie,Daughters of the Dust,Julie Dash,"Cora Lee Day, Alva Rogers, Barbarao, Trula Hoosier, Adisa Anderson, Kaycee Moore, Bahni Turpin, Cheryl Lynn Bruce, Tommy Redmond Hicks, Cornell Royal","United Kingdom, United States",1991,NR,112 min,"Classic Movies, Dramas, Independent Movies"
6575,Movie,De Palma,"Noah Baumbach, Jake Paltrow",Brian De Palma,United States,2015,R,110 min,Documentaries
6583,Movie,Death at a Funeral,Neil LaBute,"Chris Rock, Martin Lawrence, Tracy Morgan, Danny Glover, James Marsden, Luke Wilson, Zoe Saldana, Regina Hall, Columbus Short, Peter Dinklage, Kevin Hart, Loretta Devine, Regine Nehy, Keith David, Ron Glass",United States,2010,R,93 min,Comedies
6584,Movie,Death House,Harrison Smith,"Cody Longo, Cortney Palm, Adrienne Barbeau, Michael Berryman, Barbara Crampton, Sid Haig, Gunnar Hansen, Lindsay Hartley, Kane Hodder, Lloyd Kaufman, Camille Keaton, Bill Moseley, Tony Todd, Dee Wallace, Vincent Ward, Vernon Wells",United States,2017,R,88 min,Horror Movies
6590,Movie,Delirium,Dennis Iliadis,"Topher Grace, Genesis Rodriguez, Patricia Clarkson, Callan Mulvey, Robin Thomas, Daisy McCrackin",United States,2018,R,96 min,"Horror Movies, Thrillers"
6592,Movie,Den of Thieves,Christian Gudegast,"Gerard Butler, Pablo Schreiber, O'Shea Jackson Jr., 50 Cent, Meadow Williams, Maurice Compte, Brian Van Holt, Evan Jones, Mo McRae, Kaiwi Lyman",United States,2018,R,140 min,Action & Adventure
6593,Movie,Denis Leary: No Cure For Cancer,Ted Demme,Denis Leary,United States,1992,R,62 min,Stand-Up Comedy
6617,Movie,District 9,Neill Blomkamp,"Sharlto Copley, Jason Cope, David James, Vanessa Haywood, Mandla Gaduka, Kenneth Nkosi, Eugene Khumbanyiwa, Louis Minnaar, William Allen Young, Nathalie Boltt","South Africa, United States, New Zealand, Canada",2009,R,112 min,"Action & Adventure, International Movies, Sci-Fi & Fantasy"
6623,Movie,Domino,Brian De Palma,"Nikolaj Coster-Waldau, Carice van Houten, Eriq Ebouaney, Guy Pearce, Mohammed Azaay, Søren Malling, Paprika Steen, Helena Kaittani","Denmark, France, Belgium, Italy, Netherlands, United States, United Kingdom",2019,R,89 min,"International Movies, Thrillers"
6626,Movie,Don't Be Afraid of the Dark,Troy Nixey,"Katie Holmes, Guy Pearce, Bailee Madison, Jack Thompson, Garry McDonald, Alan Dale, Julia Blake, Edwina Ritchard, Emilia Burns, Guillermo del Toro","United States, Australia, Mexico",2010,R,99 min,Horror Movies
6632,Movie,Don't Think Twice,Mike Birbiglia,"Keegan-Michael Key, Gillian Jacobs, Mike Birbiglia, Kate Micucci, Chris Gethard, Richard Masur, Tami Sagher, Erin Darke",United States,2016,R,92 min,"Comedies, Dramas, Independent Movies"
6633,Movie,Donnie Brasco,Mike Newell,"Al Pacino, Johnny Depp, Michael Madsen, Bruno Kirby, James Russo, Anne Heche, Zeljko Ivanek, Gerry Becker, Robert Miano, Zach Grenier",United States,1997,R,127 min,"Dramas, Thrillers"
6634,Movie,Doom,Andrzej Bartkowiak,"Karl Urban, Rosamund Pike, Dwayne Johnson, Deobia Oparei, Ben Daniels, Razaaq Adoti, Richard Brake, Dexter Fletcher, Al Weaver, Brian Steele","United Kingdom, Czech Republic, Germany, United States",2005,R,105 min,"Action & Adventure, Horror Movies, Sci-Fi & Fantasy"
