,type,title,director,cast,country,release_year,rating,duration,listed_in
2172,Movie,Killing Hasselhoff,Darren Grant,"Ken Jeong, David Hasselhoff, Jim Jefferies, Jon Lovitz, Rhys Darby, Dan Bakkedahl, Jennifer Ikeda, Will Sasso, Colton Dunn",United States,2017,R,80 min,Comedies
2176,Movie,Rogue Warfare: The Hunt,Mike Gunther,"Will Yun Lee, Jermaine Love, Rory Markham, Bertrand-Xavier Corbi, Katie Keene, Fernando Chien, Gina DeCesare, Michael Blalock, Chris Mulkey, Stephen Lang",United States,2020,R,104 min,Action & Adventure
2179,Movie,The Ottoman Lieutenant,Joseph Ruben,"Michiel Huisman, Hera Hilmar, Josh Hartnett, Ben Kingsley, Haluk Bilginer, Affif Ben Badra, Paul Barrett, Jessica Turner","Turkey, United States",2017,R,111 min,"Dramas, Romantic Movies"
2250,Movie,The Old Guard,Gina Prince-Bythewood,"Charlize Theron, KiKi Layne, Marwan Kenzari, Luca Marinelli, Harry Melling, Van Veronica Ngo, Matthias Schoenaerts, Chiwetel Ejiofor",United States,2020,R,126 min,Action & Adventure
2259,Movie,The Long Dumb Road,Hannah Fidell,"Tony Revolori, Jason Mantzoukas, Taissa Farmiga, Grace Gummer, Ciara Bravo, Casey Wilson, Pamela Reed, Ron Livingston",United States,2018,R,91 min,"Comedies, Independent Movies"
2311,Movie,Double Jeopardy,Bruce Beresford,"Tommy Lee Jones, Ashley Judd, Bruce Greenwood, Annabeth Gish, Roma Maffia, Jay Brazeau, Michael Gaston, Daniel Lapaine","United States, Germany, Canada",1999,R,105 min,Thrillers
2317,Movie,Total Recall,Paul Verhoeven,"Arnold Schwarzenegger, Rachel Ticotin, Sharon Stone, Michael Ironside, Ronny Cox, Marshall Bell, Michael Champion, Mel Johnson Jr., Roy Brocksmith, Rosemary Dunsmore","United States, Mexico",1990,R,114 min,"Action & Adventure, Sci-Fi & Fantasy"
2350,Movie,Woodshock,"Kate Mulleavy, Laura Mulleavy","Kirsten Dunst, Joe Cole, Pilou Asbæk, Jack Kilmer, Steph DuVall, Susan Traylor, Joel McCoy, Michael Pavlicek",United States,2017,R,101 min,"Dramas, Independent Movies, Thrillers"
2379,Movie,An Evening with Beverly Luff Linn,Jim Hosking,"Aubrey Plaza, Emile Hirsch, Jemaine Clement, Craig Robinson, Matt Berry, Zach Cherry, Maria Bamford, Michael D. Cohen, Sky Elobar, Jacob Wysocki, John Kerry, Bettina Devin, Gil Gex","United Kingdom, United States",2018,R,108 min,"Comedies, Independent Movies"
2393,Movie,Da 5 Bloods,Spike Lee,"Delroy Lindo, Jonathan Majors, Clarke Peters, Norm Lewis, Isiah Whitlock Jr., Mélanie Thierry, Paul Walter Hauser, Jasper Pääkkönen, Johnny Nguyen, Chadwick Boseman",United States,2020,R,156 min,"Action & Adventure, Dramas"
2407,Movie,Middle Men,George Gallo,"Luke Wilson, Giovanni Ribisi, Gabriel Macht, James Caan, Jacinda Barrett, Kevin Pollak, Laura Ramsey, Rade Serbedzija, Terry Crews, Kelsey Grammer",United States,2009,R,113 min,"Comedies, Dramas, Independent Movies"
2416,Movie,The Night Clerk,Michael Cristofer,"Tye Sheridan, Ana de Armas, Helen Hunt, John Leguizamo, Johnathon Schaech, Jacque Gray",United States,2020,R,90 min,"Dramas, Independent Movies"
2430,Movie,Lady Bird,Greta Gerwig,"Saoirse Ronan, Laurie Metcalf, Tracy Letts, Lucas Hedges, Timothée Chalamet, Beanie Feldstein, Lois Smith, Stephen Henderson, Odeya Rush, Jordan Rodrigues",United States,2017,R,94 min,"Comedies, Dramas, Independent Movies"
2454,Movie,The Disaster Artist,James Franco,"James Franco, Dave Franco, Seth Rogen, Josh Hutcherson, Ari Graynor, Alison Brie, Jacki Weaver, Zac Efron, Hannibal Buress, Jason Mantzoukas, Nathan Fielder, Paul Scheer, Megan Mullally, Sharon Stone, Tommy Wiseau",United States,2017,R,104 min,"Comedies, Dramas"
2471,Movie,Uncut Gems,"Josh Safdie, Benny Safdie","Adam Sandler, LaKeith Stanfield, Kevin Garnett, Julia Fox, Idina Menzel, Eric Bogosian, Judd Hirsch, Abel Tesfaye",United States,2019,R,135 min,"Dramas, Thrillers"
2479,Movie,The Lovebirds,Michael Showalter,"Issa Rae, Kumail Nanjiani, Paul Sparks, Anna Camp, Kyle Bornheimer, Nicholas X. Parsons, Andrene Ward-Hammond, Catherine Cohen, Barry Rothbart",United States,2020,R,87 min,"Action & Adventure, Comedies, Romantic Movies"
2549,Movie,John Henry,Will Forbes,"Terry Crews, Ludacris, Jamila Velazquez, J.J. Soria, Ken Foree, Daffany Clark, Kimberly Hébert-Gregory, Tyler Alvarez",United States,2020,R,92 min,"Dramas, Thrillers"
2573,Movie,The Stand at Paxton County,Brett Hedlund,"Jacqueline Toboni, Michael O'Neill, Tyler Jacob Moore, Christopher McDonald, Sean O'Bryan, Blake Sheldon, Zoe Kanters, Greg Perrow, Tanner Thomason",United States,2020,R,103 min,"Dramas, Independent Movies, Thrillers"
2576,Movie,All Day and a Night,Joe Robert Cole,"Jeffrey Wright, Ashton Sanders, Regina Taylor, Yahya Abdul-Mateen II, Isaiah John, Kelly Jenrette, Shakira Ja-nai Paye",United States,2020,R,122 min,"Dramas, Independent Movies"
2592,Movie,The Heartbreak Kid,"Bobby Farrelly, Peter Farrelly","Ben Stiller, Michelle Monaghan, Jerry Stiller, Malin Akerman, Stephanie Courtney, Rob Corddry, Carlos Mencia, Ali Hillis, Danny McBride, Scott Wilson",United States,2007,R,116 min,"Comedies, Romantic Movies"
2672,Movie,Sergio,Greg Barker,"Wagner Moura, Ana de Armas, Brían F. O'Byrne, Clemens Schick, Bradley Whitford",United States,2020,R,119 min,"Dramas, Independent Movies"
2680,Movie,Puerto Ricans in Paris,Ian Edelman,"Luis Guzmán, Edgar Garcia, Alice Taglioni, Rosie Perez, Miriam Shor, Frédéric Anscombre, Rosario Dawson, Julie Ferrier, Michaël Cohen, Ravi Patel",United States,2015,R,82 min,Comedies
2704,Movie,The Florida Project,Sean Baker,"Brooklynn Prince, Bria Vinaite, Willem Dafoe, Christopher Rivera, Valeria Cotto, Macon Blair, Caleb Landry Jones",United States,2017,R,111 min,"Dramas, Independent Movies"
2707,Movie,Angel Has Fallen,Ric Roman Waugh,"Gerard Butler, Morgan Freeman, Nick Nolte, Danny Huston, Jada Pinkett Smith, Lance Reddick, Tim Blake Nelson, Piper Perabo",United States,2019,R,121 min,Action & Adventure
2712,Movie,The Death of Stalin,Armando Iannucci,"Steve Buscemi, Simon Russell Beale, Paddy Considine, Rupert Friend, Jason Isaacs, Michael Palin, Andrea Riseborough, Jeffrey Tambor, Olga Kurylenko, Paul Chahidi","United Kingdom, France, Belgium, Canada, United States",2017,R,107 min,"Comedies, Dramas, Independent Movies"
2745,Movie,The Runaways,Floria Sigismondi,"Kristen Stewart, Dakota Fanning, Michael Shannon, Stella Maeve, Scout Taylor-Compton, Alia Shawkat, Riley Keough, Johnny Lewis, Tatum O'Neal, Brett Cullen, Hannah Marks",United States,2010,R,107 min,"Dramas, Independent Movies, Music & Musicals"
2749,Movie,Wildling,Fritz Böhm,"Bel Powley, Brad Dourif, Liv Tyler, Collin Kelly-Sordelet, James Le Gros",United States,2018,R,93 min,"Horror Movies, Independent Movies, Sci-Fi & Fantasy"
2758,Movie,Through My Father's Eyes: The Ronda Rousey Story,Gary Stretch,Ronda Rousey,"Canada, United States",2019,R,104 min,"Documentaries, Sports Movies"
2762,Movie,Rogue Warfare,Mike Gunther,"Will Yun Lee, Jermaine Love, Rory Markham, Bertrand-Xavier Corbi, Katie Keene, Fernando Chien, Gina DeCesare, Michael Blalock, Chris Mulkey, Stephen Lang",United States,2019,R,103 min,Action & Adventure
2798,Movie,3022,John Suits,"Omar Epps, Kate Walsh, Miranda Cosgrove, Angus Macfadyen, Jorja Fox, Enver Gjokaj, Haaz Sleiman",United States,2019,R,91 min,"Independent Movies, Sci-Fi & Fantasy, Thrillers"
2801,Movie,AllI Wish,Susan Walter,"Sharon Stone, Tony Goldwyn, Liza Lapira, Ellen Burstyn, Jason Gibson, Famke Janssen, Caitlin Fitzgerald, Gilles Marini, Erica Ash, Tom Paolino",United States,2017,R,95 min,"Dramas, Romantic Movies"
2809,Movie,Search Party,Scot Armstrong,"T.J. Miller, Adam Pally, Thomas Middleditch, Lance Reddick, Shannon Woodward, Alison Brie, Krysten Ritter, Jason Mantzoukas",United States,2014,R,93 min,Comedies
2822,Movie,Lost Girls,Liz Garbus,"Amy Ryan, Gabriel Byrne, Thomasin McKenzie, Lola Kirke, Oona Laurence, Dean Winters, Miriam Shor, Reed Birney, Kevin Corrigan, Stan Carp",United States,2020,R,95 min,Dramas
2836,Movie,Spenser Confidential,Peter Berg,"Mark Wahlberg, Winston Duke, Alan Arkin, Bokeem Woodbine, Iliza Shlesinger, Hope Olaide Wilson, Marc Maron",United States,2020,R,111 min,"Action & Adventure, Comedies"
2847,Movie,Freaks,"Adam B. Stein, Zach Lipovsky","Emile Hirsch, Bruce Dern, Lexy Kolker, Grace Park, Amanda Crew, Aleks Paunovic, Michelle Harrison","United States, Canada",2018,R,105 min,"Independent Movies, Sci-Fi & Fantasy, Thrillers"
2863,Movie,There Will Be Blood,Paul Thomas Anderson,"Daniel Day-Lewis, Paul Dano, Kevin J. O'Connor, Ciarán Hinds, Dillon Freasier, Sydney McCallister, David Willis, David Warshofsky, Colton Woodward, Russell Harvard",United States,2007,R,158 min,"Dramas, Independent Movies"
2897,Movie,The Last Thing He Wanted,Dee Rees,"Anne Hathaway, Ben Affleck, Willem Dafoe, Toby Jones, Rosie Perez, Edi Gathegi, Mel Rodriguez, Onata Aprile",United States,2020,R,116 min,"Dramas, Thrillers"
2903,Movie,By the Sea,Angelina Jolie,"Angelina Jolie, Brad Pitt, Mélanie Laurent, Melvil Poupaud, Niels Arestrup, Richard Bohringer","France, Malta, United States",2015,R,122 min,"Dramas, Romantic Movies"
2905,Movie,MR. RIGHT,Paco Cabezas,"Sam Rockwell, Anna Kendrick, Tim Roth, James Ransone, Anson Mount, Michael Eklund, RZA, Katie Nehra",United States,2015,R,96 min,"Action & Adventure, Comedies, Romantic Movies"
2907,Movie,Term Life,Peter Billingsley,"Vince Vaughn, Hailee Steinfeld, Jonathan Banks, Bill Paxton, Mike Epps, Jordi Mollà, William Levy, Jon Favreau, Taraji P. Henson, Shea Whigham, Cain Velasquez",United States,2016,R,93 min,"Dramas, Thrillers"
2928,Movie,Good Time,"Benny Safdie, Josh Safdie","Robert Pattinson, Benny Safdie, Jennifer Jason Leigh, Barkhad Abdi, Buddy Duress, Peter Verby, Taliah Webster, Necro",United States,2017,R,101 min,"Dramas, Independent Movies, Thrillers"
2939,Movie,Horse Girl,Jeff Baena,"Alison Brie, Debby Ryan, Paul Reiser, John Reynolds, Molly Shannon, John Ortiz, Meredith Hagner, Jake Picking, David Paymer, Jay Duplass",United States,2020,R,104 min,"Dramas, Independent Movies"
2943,Movie,The Ballad of Lefty Brown,Jared Moshé,"Bill Pullman, Kathy Baker, Jim Caviezel, Joseph Anderson, Diego Josef, Tommy Flanagan, Peter Fonda",United States,2017,R,112 min,Dramas
2960,Movie,Justice,Richard Gabai,"Nathan Parsons, Jamie-Lynn Sigler, Ellen Hollman, John Lewis, Niko Foster, Quinton Aaron, Jackson Rathbone, Robert Carradine, Lesley-Anne Down, Stephen Lang",United States,2017,R,92 min,Movies
3008,Movie,The Bling Ring,Sofia Coppola,"Emma Watson, Leslie Mann, Carlos Miranda, Israel Broussard, Taissa Farmiga, Katie Chang, Georgia Rock, Claire Julien","United States, United Kingdom, France, Germany, Japan",2013,R,91 min,"Dramas, Independent Movies"
3018,Movie,Legend,Brian Helgeland,"Tom Hardy, Emily Browning, David Thewlis, Duffy, Christopher Eccleston, Chazz Palminteri, Paul Bettany, Taron Egerton, Colin Morgan, Tara Fitzgerald","United Kingdom, France, United States",2015,R,132 min,"Dramas, International Movies, Thrillers"
3021,Movie,Steve Jobs,Danny Boyle,"Michael Fassbender, Kate Winslet, Seth Rogen, Jeff Daniels, Michael Stuhlbarg, Katherine Waterston, Perla Haney-Jardine, Sarah Snook, John Ortiz, Adam Shapiro","United Kingdom, United States",2015,R,122 min,Dramas
3043,Movie,A Ghost Story,David Lowery,"Casey Affleck, Rooney Mara, Liz Franke, Rob Zabrecky, Will Oldham, Sonia Acevedo",United States,2017,R,92 min,"Dramas, Independent Movies"
3073,Movie,Road Trip: Beer Pong,Steve Rash,"Nestor Aaron Absera, Julianna Guill, Preston Jones, Julia Levy-Boeken, Danny Pudi, Michael Trotter, Daniel Newman, DJ Qualls",United States,2009,R,97 min,Comedies
3097,Movie,Doom: Annihilation,Tony Giglio,"Amy Manson, Dominic Mafham, Luke Allen-Gale, James Weber Brown, Clayton Adams, Nina Bergman, Amer Chadha-Patel, Gavin Brocker, Chidi Ajufo, Hari Dhillon, Katrina Nare",United States,2019,R,97 min,"Action & Adventure, Horror Movies, Sci-Fi & Fantasy"
3100,Movie,Jarhead: Law of Return,Don Michael Paul,"Amaury Nolasco, Devon Sawa, Robert Patrick, Jeff Pierre, Ben Cross, Amos Tamam, Yael Eitan, Tsahi Halevi","Israel, United States",2019,R,103 min,"Action & Adventure, Dramas"
3107,Movie,Jacob's Ladder,David M. Rosenthal,"Michael Ealy, Jesse Williams, Nicole Beharie, Guy Burnet, Joseph Sikora, Karla Souza, Ritchie Coster, Jon Eyez",United States,2019,R,90 min,Thrillers
3125,Movie,The Danish Girl,Tom Hooper,"Eddie Redmayne, Alicia Vikander, Ben Whishaw, Sebastian Koch, Amber Heard, Matthias Schoenaerts, Pip Torrens, Nicholas Woodeson, Emerald Fennell, Adrian Schiller","United Kingdom, United States, Germany, Denmark, Belgium, Japan",2015,R,120 min,"Dramas, Independent Movies, International Movies"
3150,Movie,6 Underground,Michael Bay,"Ryan Reynolds, Mélanie Laurent, Corey Hawkins, Dave Franco, Adria Arjona, Manuel Garcia-Rulfo, Ben Hardy, Lior Raz, Payman Maadi, Yuri Kolokolnikov, Kim Kold",United States,2019,R,129 min,"Action & Adventure, Dramas"
3162,Movie,It Comes at Night,Trey Edward Shults,"Joel Edgerton, Christopher Abbott, Carmen Ejogo, Riley Keough, Kelvin Harrison Jr., David Pendleton, Griffin Robert Faulkner",United States,2017,R,92 min,"Horror Movies, Independent Movies"
3169,Movie,Marriage Story,Noah Baumbach,"Scarlett Johansson, Adam Driver, Laura Dern, Alan Alda, Ray Liotta, Julie Hagerty, Merritt Wever, Azhy Robertson","United Kingdom, United States",2019,R,137 min,Dramas
3190,Movie,Cut Bank,Matt Shakman,"Liam Hemsworth, Teresa Palmer, Billy Bob Thornton, Bruce Dern, John Malkovich, Michael Stuhlbarg, Oliver Platt",United States,2014,R,93 min,"Dramas, Thrillers"
3223,Movie,Defiance,Edward Zwick,"Daniel Craig, Liev Schreiber, Jamie Bell, Alexa Davalos, Allan Corduner, Mark Feuerstein, Tomas Arana, Jodhi May, Kate Fahy, Iddo Goldberg, George MacKay, Iben Hjejle, Martin Hancock, Jacek Koman, Ravil Isyanov",United States,2008,R,137 min,"Action & Adventure, Dramas"
3227,Movie,The Irishman,Martin Scorsese,"Robert De Niro, Al Pacino, Joe Pesci, Harvey Keitel, Ray Romano, Bobby Cannavale, Anna Paquin, Stephen Graham, Stephanie Kurtzuba, Kathrine Narducci, Welker White, Jesse Plemons, Jack Huston, Domenick Lombardozzi, Louis Cancelmi, Paul Herman, Gary Basaraba, Marin Ireland, Sebastian Maniscalco, Steven Van Zandt",United States,2019,R,209 min,Dramas
3235,Movie,Shot Caller,Ric Roman Waugh,"Nikolaj Coster-Waldau, Omari Hardwick, Lake Bell, Jon Bernthal, Emory Cohen, Jeffrey Donovan, Evan Jones, Benjamin Bratt, Holt McCallany",United States,2017,R,121 min,"Dramas, Thrillers"
3262,Movie,The Green Inferno,Eli Roth,"Ignacia Allamand, Daryl Sabara, Nicolás Martínez, Lorenza Izzo, Ariel Levy, Magda Apanowicz, Sky Ferreira, Kirby Bliss Blanton, Aaron Burns, Ramón Llao, Richard Burgi","United States, Chile",2013,R,101 min,"Horror Movies, Independent Movies"
3264,Movie,Earthquake Bird,Wash Westmoreland,"Alicia Vikander, Riley Keough, Naoki Kobayashi, Jack Huston, Kiki Sukezane, Yoshiko Sakuma, Ken Yamamura, Kazuhiro Muroyama, Akiko Iwase, Crystal Kay","United Kingdom, Japan, United States",2019,R,107 min,"Dramas, Romantic Movies"
3290,Movie,A Single Man,Tom Ford,"Colin Firth, Julianne Moore, Nicholas Hoult, Ginnifer Goodwin, Matthew Goode, Paul Butler, Ryan Simpkins, Teddy Sears, Paulette Lamori, Jon Kortajarena",United States,2009,R,100 min,"Dramas, Independent Movies, LGBTQ Movies"
3307,Movie,The Lovers,Azazel Jacobs,"Aidan Gillen, Melora Walters, Tyler Ross, Jessica Sula, Lesley Fera, Tracy Letts, Debra Winger",United States,2017,R,98 min,"Comedies, Dramas, Independent Movies"
3309,Movie,Undercover Brother 2,Leslie Small,"Michael Jai White, Vince Swann, Barry Bostwick, Laila Odom, Gary Owen, Affion Crockett, Steven Lee Johnson, Lindsay Lamb, Zac Zedalis, Cj Sykes",United States,2019,R,85 min,Comedies
3372,Movie,Dolemite Is My Name,Craig Brewer,"Eddie Murphy, Wesley Snipes, Keegan-Michael Key, Mike Epps, Craig Robinson, Tituss Burgess, Da'Vine Joy Randolph, Kodi Smit-McPhee",United States,2019,R,118 min,"Comedies, Dramas"
3409,Movie,The Laundromat,Steven Soderbergh,"Meryl Streep, Gary Oldman, Antonio Banderas, Sharon Stone, James Cromwell, Jeffrey Wright, Melissa Rauch, Jeff Michalski, Jane Morris, Robert Patrick, David Schwimmer",United States,2019,R,96 min,"Comedies, Dramas"
3421,Movie,Sinister 2,Ciarán Foy,"Shannyn Sossamon, John Beasley, James Ransone, Tate Ellington, Robert Daniel Sloan, Dartanian Sloan, Lucas Jade Zumann, Lea Coco","United States, United Kingdom",2015,R,97 min,Horror Movies
3476,Movie,The Squid and the Whale,Noah Baumbach,"Jeff Daniels, Laura Linney, Jesse Eisenberg, Owen Kline, William Baldwin, Halley Feiffer, Anna Paquin, Ken Leung, David Benger, Adam Rose",United States,2005,R,81 min,"Comedies, Dramas, Independent Movies"
3494,Movie,Inside Man: Most Wanted,Michael J. Bassett,"Aml Ameen, Rhea Seehorn, Roxanne McKee, Urs Rechn, Akshay Kumar, Tanya van Graan, Andre Jacobs, Sven Ruygrok",United States,2019,R,106 min,Action & Adventure
3717,Movie,Triple Threat,"Jesse V. Johnson, Jesse Johnson","Tony Jaa, Iko Uwais, Tiger Chen, Scott Adkins, Celina Jade, Michael Bisping, Michael Jai White, JeeJa Yanin, Dominiquie Vandenberg","Thailand, China, United States",2019,R,96 min,"Action & Adventure, International Movies"
3734,Movie,Cop Car,Jon Watts,"Kevin Bacon, James Freedson-Jackson, Hays Wellford, Camryn Manheim, Shea Whigham, Sean Hartley, Kyra Sedgwick, Loi Nguyen",United States,2015,R,88 min,Thrillers
3825,Movie,Backdraft 2,Gonzalo López-Gallego,"Joe Anderson, William Baldwin, Donald Sutherland, Alisha Bailey, Alastair Mackenzie, Dominic Mafham, Jessamine-Bliss Bell, Martin Hutson, Aaron McCusker, Cyril Nri",United States,2019,R,102 min,"Action & Adventure, Dramas"
3841,Movie,Wine Country,Amy Poehler,"Amy Poehler, Maya Rudolph, Ana Gasteyer, Rachel Dratch, Paula Pell, Emily Spivey, Tina Fey, Jason Schwartzman",United States,2019,R,104 min,Comedies
3863,Movie,"Extremely Wicked, Shockingly Evil and Vile",Joe Berlinger,"Zac Efron, Lily Collins, Kaya Scodelario, Jeffrey Donovan, Angela Sarafyan, Jim Parsons, John Malkovich, Haley Joel Osment, Dylan Baker, Brian Geraghty",United States,2019,R,110 min,"Dramas, Independent Movies"
3869,Movie,Olympus Has Fallen,Antoine Fuqua,"Gerard Butler, Aaron Eckhart, Morgan Freeman, Finley Jacobsen, Dylan McDermott, Rick Yune, Angela Bassett, Melissa Leo, Radha Mitchell, Cole Hauser, Ashley Judd, Robert Forster",United States,2013,R,119 min,Action & Adventure
3903,Movie,Someone Great,Jennifer Kaytin Robinson,"Gina Rodriguez, Brittany Snow, DeWanda Wise, Lakeith Stanfield, RuPaul Charles, Peter Vack, Alex Moffat, Rosario Dawson, Rebecca Naomi Jones, Jaboukie Young-White, Michelle Buteau, Questlove",United States,2019,R,92 min,"Comedies, Romantic Movies"
3966,Movie,The Highwaymen,John Lee Hancock,"Kevin Costner, Woody Harrelson, Kathy Bates, John Carroll Lynch, Thomas Mann, Kim Dickens, W. Earl Brown, William Sadler",United States,2019,R,132 min,Dramas
4024,Movie,Triple Frontier,J.C. Chandor,"Ben Affleck, Oscar Isaac, Charlie Hunnam, Pedro Pascal, Garrett Hedlund, Adria Arjona",United States,2019,R,126 min,Action & Adventure
4095,Movie,Black Sea,Kevin MacDonald,"Jude Law, Scoot McNairy, Ben Mendelsohn, Bobby Schofield, Tobias Menzies, Michael Smiley, Grigoriy Dobrygin, David Threlfall, Jodie Whittaker, Karl Davies","United Kingdom, Russia, United States",2015,R,114 min,"Action & Adventure, Dramas, International Movies"
4146,Movie,Velvet Buzzsaw,Dan Gilroy,"Jake Gyllenhaal, Rene Russo, Zawe Ashton, Toni Collette, John Malkovich, Natalia Dyer, Daveed Diggs, Tom Sturridge",United States,2019,R,113 min,"Dramas, Thrillers"
4268,Movie,Bird Box,Susanne Bier,"Sandra Bullock, Trevante Rhodes, John Malkovich, Sarah Paulson, BD Wong, Jacki Weaver, Rosa Salazar, Danielle Macdonald, Lil Rel Howery, Tom Hollander",United States,2018,R,124 min,"Dramas, Sci-Fi & Fantasy, Thrillers"
4291,Movie,Kill the Messenger,Michael Cuesta,"Jeremy Renner, Rosemarie DeWitt, Ray Liotta, Tim Blake Nelson, Oliver Platt, Barry Pepper, Michael Sheen, Paz Vega, Michael Kenneth Williams, Mary Elizabeth Winstead, Andy Garcia, Robert Patrick",United States,2014,R,112 min,"Dramas, Thrillers"
4292,Movie,Maps to the Stars,David Cronenberg,"Julianne Moore, Mia Wasikowska, Robert Pattinson, John Cusack, Olivia Williams, Sarah Gadon, Evan Bird, Niamh Wilson, Dawn Greenhalgh","Canada, Germany, France, United States",2014,R,112 min,"Comedies, Dramas"
4306,Movie,ROMA,Alfonso Cuarón,"Yalitza Aparicio, Marina de Tavira","Mexico, United States",2018,R,135 min,"Dramas, Independent Movies, International Movies"
4385,Movie,The Ballad of Buster Scruggs,"Joel Coen, Ethan Coen","Liam Neeson, James Franco, Tim Blake Nelson, Tom Waits, Zoe Kazan, Brendan Gleeson",United States,2018,R,133 min,"Comedies, Dramas"
4404,Movie,Outlaw King,David Mackenzie,"Chris Pine, Aaron Taylor-Johnson, Florence Pugh, Billy Howle, Sam Spruell, Tony Curran, Callan Mulvey, James Cosmo, Stephen Dillane","United Kingdom, United States",2018,R,122 min,"Action & Adventure, Dramas"
4418,Movie,The Other Side of the Wind,Orson Welles,"John Huston, Oja Kodar, Peter Bogdanovich, Susan Strasberg, Robert Random, Lilli Palmer, Norman Foster, Edmond O'Brien, Mercedes McCambridge, Cameron Mitchell, Paul Stewart","France, Iran, United States",2018,R,122 min,"Classic Movies, Dramas, Independent Movies"
4519,Movie,The Kindergarten Teacher,Sara Colangelo,"Maggie Gyllenhaal, Parker Sevak, Gael García Bernal, Michael Chernus, Anna Baryshnikov, Rosa Salazar, Ajay Naidu","United States, Israel, United Kingdom, Canada",2018,R,97 min,"Dramas, Independent Movies"
4522,Movie,22 July,Paul Greengrass,"Anders Danielsen Lie, Jon Øigarden, Jonas Strand Gravli, Ola G. Furuseth, Maria Bock, Thorbjørn Harr, Jaden Smith","Norway, Iceland, United States",2018,R,144 min,"Dramas, Thrillers"
4524,Movie,Tales From the Hood 2,"Rusty Cundieff, Darin Scott","Keith David, Bryan Batt, Alexandria Deberry, Bill Martin Williams, Martin Bats Bradford, Kendrick Cross, Jasmine Akakpo, Kedrick Brown",United States,2018,R,110 min,"Cult Movies, Horror Movies, Independent Movies"
4533,Movie,Private Life,Tamara Jenkins,"Paul Giamatti, Kathryn Hahn, Kayli Carter, Molly Shannon, John Carroll Lynch, Denis O'Hare, Desmin Borges, Tracee Chimo, Siobhan Fallon Hogan, Emily Robinson",United States,2018,R,124 min,"Comedies, Dramas, Independent Movies"
4539,Movie,Death Race: Beyond Anarchy,Don Michael Paul,"Zach McGowan, Danny Glover, Frederick Koehler, Danny Trejo, Christine Marzano, Cassie Clare, Yennis Cheung, Lucy Aarden","United States, Bulgaria",2017,R,111 min,Action & Adventure
4812,Movie,TAU,Federico D'Alessandro,"Maika Monroe, Ed Skrein, Gary Oldman",United States,2018,R,98 min,"Sci-Fi & Fantasy, Thrillers"
4901,Movie,The Clapper,Dito Montiel,"Ed Helms, Amanda Seyfried, Tracy Morgan, Brenda Vaccaro, P.J. Byrne, Leah Remini, Mickey Gooch Jr., Adam Levine, Russell Peters, Alan Thicke",United States,2017,R,90 min,"Comedies, Dramas, Independent Movies"
4927,Movie,Beyond Skyline,Liam O'Donnell,"Frank Grillo, Bojana Novakovic, Jonny Weston, Callan Mulvey, Antonio Fargas, Yayan Ruhian, Pamelyn Chee, Jacob Vargas, Iko Uwais","United States, Canada, Indonesia, United Kingdom, China, Singapore",2017,R,107 min,"Action & Adventure, Sci-Fi & Fantasy"
4996,Movie,Bullet Head,"Paul Solet, Rick Benattar","Adrien Brody, John Malkovich, Rory Culkin, Antonio Banderas, Ori Pfeffer, Alexandra Dinu, Owen Davis, Deyan Petrov","Bulgaria, United States",2017,R,94 min,"International Movies, Thrillers"
5010,Movie,Love Beats Rhymes,RZA,"Azealia Banks, Lucien Laviscount, Jill Scott, Common, Lorraine Toussaint, Hana Mae Lee, Jeremie Harris",United States,2016,R,106 min,"Dramas, Music & Musicals, Romantic Movies"
5064,Movie,Acts of Vengeance,Isaac Florentine,"Antonio Banderas, Karl Urban, Paz Vega, Robert Forster, Clint Dyer, Cristina Serafini, Lillian Blankenship, Atanas Srebrev, Mark Rhino Smith","Bulgaria, United States",2017,R,87 min,"Action & Adventure, International Movies"
5101,Movie,Fun Mom Dinner,Alethea Jones,"Katie Aselton, Toni Collette, Bridget Everett, Molly Shannon, Adam Scott, Rob Huebel, Adam Levine, Paul Rust",United States,2017,R,82 min,"Comedies, International Movies"
5116,Movie,Jeremiah Tower: The Last Magnificent,Lydia Tenaglia,"Jeremiah Tower, Anthony Bourdain, Mario Batali, Ruth Reichl","Mexico, United States",2016,R,103 min,Documentaries
5167,Movie,Mudbound,Dee Rees,"Carey Mulligan, Jason Clarke, Mary J. Blige, Garrett Hedlund, Jason Mitchell, Rob Morgan, Jonathan Banks",United States,2017,R,135 min,"Dramas, Independent Movies"
5179,Movie,Jerry Seinfeld: Comedian,Christian Charles,"Jerry Seinfeld, Orny Adams, Colin Quinn, Bill Cosby, Robert Klein, Chris Rock, Garry Shandling, Jay Leno, Kevin Nealon, Ray Romano",United States,2002,R,81 min,Documentaries
5181,Movie,The Journey Is the Destination,Bronwen Hughes,"Ben Schnetzer, Kelly Macdonald, Sam Hazeldine, Ella Purnell, Maria Bello, Yusra Warsama",United States,2016,R,123 min,Dramas
5197,Movie,The B-Side: Elsa Dorfman's Portrait Photography,Errol Morris,Elsa Dorfman,United States,2016,R,76 min,Documentaries
5202,Movie,Strange Weather,Katherine Dieckmann,"Holly Hunter, Carrie Coon, Kim Coates, Shane Jacobsen, Andrene Ward-Hammond, Allene Quincy, Glenne Headly",United States,2016,R,91 min,"Dramas, Independent Movies"
5203,Movie,The Hateful Eight,Quentin Tarantino,"Samuel L. Jackson, Kurt Russell, Jennifer Jason Leigh, Walton Goggins, Demián Bichir, Tim Roth, Michael Madsen, Bruce Dern, James Parks, Dana Gourrier, Channing Tatum, Zoë Bell",United States,2015,R,168 min,"Action & Adventure, Thrillers"
5267,Movie,The Bad Batch,Ana Lily Amirpour,"Suki Waterhouse, Jason Momoa, Keanu Reeves, Jim Carrey, Giovanni Ribisi, Yolonda Ross",United States,2016,R,119 min,"Dramas, Independent Movies, Thrillers"
5332,Movie,Demonic,Will Canon,"Maria Bello, Frank Grillo, Cody Horn, Dustin Milligan, Megan Park, Scott Mechlowicz, Aaron Yoo, Alex Goode, Terence Rosemore, Jesse Steccato",United States,2015,R,83 min,"Horror Movies, Independent Movies"
